"Activity_Name","Heart_Rate","Calories_Burned","Duration","Active_Duration","Steps","lastModified","startTime","originalStartTime","originalDuration","Elevation_Gain","hasActiveZoneMinutes","distance","distanceUnit","speed","pace","Date","Duration_Minutes"
"Gehen",102,136,1382000,1382000,2134,"11/09/19 19:25:36","11/09/19 18:42:59","11/09/19 18:42:59",1382000,0,"FALSE",NA,NA,NA,NA,2019-11-09,23.03
"Laufen",75,0,308000,12000,0,"11/09/19 20:20:19","11/09/19 20:15:02","11/09/19 20:15:02",308000,0,"FALSE",0,"Kilometer",0,NA,2019-11-09,5.13
"Gehen",108,234,2406000,2406000,4009,"11/10/19 15:39:08","11/10/19 14:48:49","11/10/19 14:48:49",2406000,0,"FALSE",NA,NA,NA,NA,2019-11-10,40.1
"Training",144,461,3194000,3190000,4508,"11/10/19 16:44:37","11/10/19 15:50:31","11/10/19 15:50:31",3194000,3.353,"FALSE",NA,NA,NA,NA,2019-11-10,53.23
"Gehen",105,117,1331000,1331000,1887,"11/10/19 19:38:57","11/10/19 18:37:31","11/10/19 18:37:31",1331000,0,"FALSE",NA,NA,NA,NA,2019-11-10,22.18
"Gehen",104,130,1433000,1433000,2192,"11/11/19 19:19:52","11/11/19 18:40:36","11/11/19 18:40:36",1433000,0,"FALSE",NA,NA,NA,NA,2019-11-11,23.88
"Gehen",104,223,2304000,2304000,3835,"11/12/19 16:22:56","11/12/19 14:15:11","11/12/19 14:15:11",2304000,3.048,"FALSE",NA,NA,NA,NA,2019-11-12,38.4
"Training",136,457,3512000,3507000,4576,"11/12/19 16:30:33","11/12/19 15:31:16","11/12/19 15:31:16",3512000,7.62,"FALSE",NA,NA,NA,NA,2019-11-12,58.53
"Gehen",103,137,1587000,1587000,2251,"11/12/19 19:57:54","11/12/19 18:42:18","11/12/19 18:42:18",1587000,0,"FALSE",NA,NA,NA,NA,2019-11-12,26.45
"Gehen",109,248,2714000,2714000,3962,"11/13/19 12:32:45","11/13/19 08:10:28","11/13/19 08:10:28",2714000,0,"FALSE",NA,NA,NA,NA,2019-11-13,45.23
"Gehen",106,228,2509000,2509000,3805,"11/13/19 15:39:50","11/13/19 14:14:01","11/13/19 14:14:01",2509000,0,"FALSE",NA,NA,NA,NA,2019-11-13,41.82
"Gehen",102,116,1382000,1382000,1839,"11/13/19 19:26:27","11/13/19 18:42:50","11/13/19 18:42:50",1382000,0,"FALSE",NA,NA,NA,NA,2019-11-13,23.03
"Gehen",103,245,2714000,2714000,4111,"11/14/19 15:13:36","11/14/19 14:10:16","11/14/19 14:10:16",2714000,6.096,"FALSE",NA,NA,NA,NA,2019-11-14,45.23
"Training",133,453,3580000,3576000,5022,"11/14/19 16:28:19","11/14/19 15:27:13","11/14/19 15:27:13",3580000,12.497,"FALSE",NA,NA,NA,NA,2019-11-14,59.67
"Gehen",104,148,1639000,1639000,2404,"11/14/19 19:18:04","11/14/19 18:43:25","11/14/19 18:43:25",1639000,3.048,"FALSE",NA,NA,NA,NA,2019-11-14,27.32
"Gehen",102,236,2560000,2560000,4020,"11/15/19 18:11:52","11/15/19 14:44:10","11/15/19 14:44:10",2560000,2.54,"FALSE",NA,NA,NA,NA,2019-11-15,42.67
"Gehen",107,108,1280000,1280000,1707,"11/16/19 06:59:54","11/15/19 18:48:14","11/15/19 18:48:14",1280000,0,"FALSE",NA,NA,NA,NA,2019-11-16,21.33
"Gehen",103,232,2458000,2458000,3933,"11/16/19 16:28:23","11/16/19 13:35:35","11/16/19 13:35:35",2458000,9.144,"FALSE",NA,NA,NA,NA,2019-11-16,40.97
"Gehen",99,70,922000,922000,1027,"11/16/19 17:59:29","11/16/19 16:11:46","11/16/19 16:11:46",922000,0,"FALSE",NA,NA,NA,NA,2019-11-16,15.37
"Gehen",97,147,1741000,1741000,2405,"11/16/19 19:14:46","11/16/19 18:41:58","11/16/19 18:41:58",1741000,0,"FALSE",NA,NA,NA,NA,2019-11-16,29.02
"Gehen",107,110,1127000,1127000,1687,"11/17/19 08:33:29","11/17/19 07:56:29","11/17/19 07:56:29",1127000,3.86,"FALSE",NA,NA,NA,NA,2019-11-17,18.78
"Laufen",144,362,2309000,2206000,5466,"11/17/19 09:16:24","11/17/19 08:33:57","11/17/19 08:33:57",2309000,2.438,"FALSE",4.119515,"Kilometer",6.6247017225748,543.420692849067,2019-11-17,38.48
"Gehen",104,249,2612000,2612000,4161,"11/17/19 17:43:11","11/17/19 14:23:56","11/17/19 14:23:56",2612000,6.096,"FALSE",NA,NA,NA,NA,2019-11-17,43.53
"Gehen",100,141,1588000,1588000,2293,"11/17/19 19:05:38","11/17/19 18:35:41","11/17/19 18:35:41",1588000,0,"FALSE",NA,NA,NA,NA,2019-11-17,26.47
"Gehen",96,126,1536000,1536000,2136,"11/18/19 13:37:08","11/18/19 07:50:12","11/18/19 07:50:12",1536000,0,"FALSE",NA,NA,NA,NA,2019-11-18,25.6
"Gehen",96,238,2663000,2663000,4152,"11/18/19 18:14:45","11/18/19 14:12:31","11/18/19 14:12:31",2663000,0,"FALSE",NA,NA,NA,NA,2019-11-18,44.38
"Gehen",99,112,1332000,1332000,1804,"11/18/19 20:48:19","11/18/19 18:34:31","11/18/19 18:34:31",1332000,0,"FALSE",NA,NA,NA,NA,2019-11-18,22.2
"Gehen",104,187,1997000,1997000,3111,"11/19/19 14:50:17","11/19/19 13:55:10","11/19/19 13:55:10",1997000,0,"FALSE",NA,NA,NA,NA,2019-11-19,33.28
"Laufen",144,269,1711000,1682000,4336,"11/19/19 15:13:31","11/19/19 14:44:44","11/19/19 14:44:44",1711000,1.524,"FALSE",3.915429,"Kilometer",8.22730558858502,437.567313045333,2019-11-19,28.52
"Gehen",96,135,1895000,1895000,2136,"11/19/19 20:10:02","11/19/19 18:45:21","11/19/19 18:45:21",1895000,0,"FALSE",NA,NA,NA,NA,2019-11-19,31.58
"Gehen",101,215,2356000,2356000,3736,"11/20/19 18:13:11","11/20/19 14:15:20","11/20/19 14:15:20",2356000,0,"FALSE",NA,NA,NA,NA,2019-11-20,39.27
"Gehen",97,73,922000,922000,1190,"11/20/19 19:08:16","11/20/19 18:44:10","11/20/19 18:44:10",922000,0,"FALSE",NA,NA,NA,NA,2019-11-20,15.37
"Laufen",120,487,4239000,4063000,8340,"11/21/19 08:14:51","11/21/19 07:02:43","11/21/19 07:02:43",4239000,10.668,"FALSE",5.767523,"Kilometer",5.11275313807531,704.121615649766,2019-11-21,70.65
"Gehen",94,278,3533000,3533000,4581,"11/21/19 18:26:04","11/21/19 14:09:03","11/21/19 14:09:03",3533000,0,"FALSE",NA,NA,NA,NA,2019-11-21,58.88
"Gehen",99,136,1588000,1588000,2228,"11/21/19 19:26:15","11/21/19 18:44:41","11/21/19 18:44:41",1588000,0,"FALSE",NA,NA,NA,NA,2019-11-21,26.47
"Gehen",99,137,1536000,1536000,2392,"11/22/19 16:10:41","11/22/19 07:49:06","11/22/19 07:49:06",1536000,3.048,"FALSE",NA,NA,NA,NA,2019-11-22,25.6
"Gehen",108,235,2305000,2305000,4018,"11/22/19 16:10:41","11/22/19 14:13:58","11/22/19 14:13:58",2305000,6.096,"FALSE",NA,NA,NA,NA,2019-11-22,38.42
"Training",134,402,3086000,3082000,4400,"11/22/19 16:10:35","11/22/19 15:17:20","11/22/19 15:17:20",3086000,5.486,"FALSE",NA,NA,NA,NA,2019-11-22,51.43
"Gehen",102,126,1434000,1434000,2036,"11/22/19 19:06:13","11/22/19 18:39:32","11/22/19 18:39:32",1434000,9.144,"FALSE",NA,NA,NA,NA,2019-11-22,23.9
"Gehen",107,232,2355000,2355000,3875,"11/23/19 18:06:55","11/23/19 14:10:23","11/23/19 14:10:23",2355000,24.384,"FALSE",NA,NA,NA,NA,2019-11-23,39.25
"Gehen",97,96,1126000,1126000,1509,"11/28/19 22:34:58","11/23/19 18:49:27","11/23/19 18:49:27",1126000,0.66,"FALSE",NA,NA,NA,NA,2019-11-28,18.77
"Gehen",97,95,1280000,1280000,1342,"11/24/19 13:20:09","11/24/19 07:52:00","11/24/19 07:52:00",1280000,0,"FALSE",NA,NA,NA,NA,2019-11-24,21.33
"Gehen",105,252,2612000,2612000,4190,"11/24/19 18:13:07","11/24/19 14:41:38","11/24/19 14:41:38",2612000,0,"FALSE",NA,NA,NA,NA,2019-11-24,43.53
"Training",132,465,3615000,3612000,4638,"11/24/19 18:13:04","11/24/19 15:43:26","11/24/19 15:43:26",3615000,6.096,"FALSE",NA,NA,NA,NA,2019-11-24,60.25
"Fitbit Coach: Personal Trainer",138,45,370000,370000,102,"11/24/19 16:41:09","11/24/19 16:34:59","11/24/19 16:34:59",370000,NA,"FALSE",0,"Kilometer",0,NA,2019-11-24,6.17
"Gehen",102,140,1536000,1536000,2278,"11/24/19 20:23:31","11/24/19 18:38:12","11/24/19 18:38:12",1536000,0,"FALSE",NA,NA,NA,NA,2019-11-24,25.6
"Gehen",102,252,2817000,2817000,4071,"11/25/19 15:50:47","11/25/19 13:58:48","11/25/19 13:58:48",2817000,0,"FALSE",NA,NA,NA,NA,2019-11-25,46.95
"Gehen",95,106,1229000,1229000,1806,"11/25/19 21:11:09","11/25/19 18:47:15","11/25/19 18:47:15",1229000,0,"FALSE",NA,NA,NA,NA,2019-11-25,20.48
"Gehen",101,134,1434000,1434000,2175,"11/26/19 16:11:44","11/26/19 07:55:48","11/26/19 07:55:48",1434000,0,"FALSE",NA,NA,NA,NA,2019-11-26,23.9
"Gehen",101,205,2202000,2202000,3408,"11/26/19 16:11:45","11/26/19 14:27:31","11/26/19 14:27:31",2202000,0,"FALSE",NA,NA,NA,NA,2019-11-26,36.7
"Gehen",96,131,1536000,1536000,2223,"11/26/19 21:02:17","11/26/19 18:39:17","11/26/19 18:39:17",1536000,0,"FALSE",NA,NA,NA,NA,2019-11-26,25.6
"Training",130,408,3191000,3187000,4528,"11/27/19 11:07:16","11/27/19 10:05:33","11/27/19 10:05:33",3191000,8.839,"FALSE",NA,NA,NA,NA,2019-11-27,53.18
"Gehen",100,243,2765000,2765000,3987,"11/27/19 15:46:16","11/27/19 14:41:02","11/27/19 14:41:02",2765000,0,"FALSE",NA,NA,NA,NA,2019-11-27,46.08
"Gehen",98,120,1382000,1382000,1954,"11/27/19 20:25:12","11/27/19 18:40:51","11/27/19 18:40:51",1382000,0,"FALSE",NA,NA,NA,NA,2019-11-27,23.03
"Gehen",103,238,2458000,2458000,4062,"11/28/19 15:13:22","11/28/19 14:27:57","11/28/19 14:27:57",2458000,0,"FALSE",NA,NA,NA,NA,2019-11-28,40.97
"Gehen",94,118,1536000,1536000,1930,"11/28/19 21:20:45","11/28/19 18:47:24","11/28/19 18:47:24",1536000,0,"FALSE",NA,NA,NA,NA,2019-11-28,25.6
"Gehen",109,250,2509000,2509000,4117,"11/29/19 15:26:52","11/29/19 14:33:35","11/29/19 14:33:35",2509000,0,"FALSE",NA,NA,NA,NA,2019-11-29,41.82
"Laufen",147,369,2267000,2184000,5630,"11/29/19 16:42:20","11/29/19 15:24:45","11/29/19 15:24:45",2267000,2.134,"FALSE",3.952078,"Kilometer",6.45125274725275,558.031151629124,2019-11-29,37.78
"Gehen",104,116,1332000,1332000,1818,"11/29/19 19:14:27","11/29/19 18:45:25","11/29/19 18:45:25",1332000,0,"FALSE",NA,NA,NA,NA,2019-11-29,22.2
"Gehen",101,122,1332000,1332000,2041,"11/30/19 10:08:03","11/30/19 07:42:55","11/30/19 07:42:55",1332000,0,"FALSE",NA,NA,NA,NA,2019-11-30,22.2
"Gehen",96,108,1331000,1331000,1774,"11/30/19 19:10:09","11/30/19 18:44:18","11/30/19 18:44:18",1331000,0,"FALSE",NA,NA,NA,NA,2019-11-30,22.18
"Gehen",101,145,1638000,1638000,2458,"12/01/19 09:14:47","12/01/19 07:48:34","12/01/19 07:48:34",1638000,0,"FALSE",NA,NA,NA,NA,2019-12-01,27.3
"Laufen",148,418,2535000,2520000,6557,"12/01/19 09:55:23","12/01/19 09:12:54","12/01/19 09:12:54",2535000,3.048,"FALSE",4.398453,"Kilometer",6.12195714285714,588.04723979493,2019-12-01,42.25
"Gehen",105,138,1536000,1536000,2261,"12/01/19 17:11:31","12/01/19 14:09:12","12/01/19 14:09:12",1536000,3.048,"FALSE",NA,NA,NA,NA,2019-12-01,25.6
"Gehen",100,128,1485000,1485000,2069,"12/01/19 19:55:04","12/01/19 18:41:26","12/01/19 18:41:26",1485000,3.048,"FALSE",NA,NA,NA,NA,2019-12-01,24.75
"Gehen",102,107,1177000,1177000,1757,"12/02/19 20:09:30","12/02/19 07:55:58","12/02/19 07:55:58",1177000,0,"FALSE",NA,NA,NA,NA,2019-12-02,19.62
"Gehen",100,201,2253000,2253000,3463,"12/02/19 20:09:30","12/02/19 14:07:11","12/02/19 14:07:11",2253000,0,"FALSE",NA,NA,NA,NA,2019-12-02,37.55
"Gehen",97,132,1587000,1587000,2178,"12/02/19 20:09:30","12/02/19 18:41:59","12/02/19 18:41:59",1587000,0,"FALSE",NA,NA,NA,NA,2019-12-02,26.45
"Gehen",105,123,1331000,1331000,2080,"12/03/19 08:21:48","12/03/19 07:37:45","12/03/19 07:37:45",1331000,0,"FALSE",NA,NA,NA,NA,2019-12-03,22.18
"Gehen",100,269,3277000,3277000,4441,"12/03/19 15:20:54","12/03/19 14:18:50","12/03/19 14:18:50",3277000,0,"FALSE",NA,NA,NA,NA,2019-12-03,54.62
"Gehen",100,107,1280000,1280000,1652,"12/03/19 19:24:30","12/03/19 18:45:57","12/03/19 18:45:57",1280000,0,"FALSE",NA,NA,NA,NA,2019-12-03,21.33
"Gehen",102,109,1383000,1383000,1812,"12/04/19 12:41:49","12/04/19 08:57:50","12/04/19 08:57:50",1383000,9.144,"FALSE",NA,NA,NA,NA,2019-12-04,23.05
"Gehen",99,233,2714000,2714000,3864,"12/04/19 15:04:30","12/04/19 14:12:45","12/04/19 14:12:45",2714000,0,"FALSE",NA,NA,NA,NA,2019-12-04,45.23
"Training",124,424,3853000,3850000,4765,"12/04/19 16:35:03","12/04/19 15:27:55","12/04/19 15:27:55",3853000,4.267,"FALSE",NA,NA,NA,NA,2019-12-04,64.22
"Gehen",104,142,1587000,1587000,2325,"12/05/19 12:09:09","12/05/19 07:40:11","12/05/19 07:40:11",1587000,3.048,"FALSE",NA,NA,NA,NA,2019-12-05,26.45
"Gehen",97,268,3431000,3431000,4219,"12/05/19 18:14:30","12/05/19 14:19:34","12/05/19 14:19:34",3431000,3.048,"FALSE",NA,NA,NA,NA,2019-12-05,57.18
"Gehen",101,130,1485000,1485000,2196,"12/05/19 19:33:20","12/05/19 18:41:34","12/05/19 18:41:34",1485000,0,"FALSE",NA,NA,NA,NA,2019-12-05,24.75
"Gehen",99,255,3021000,3021000,4161,"12/06/19 15:13:24","12/06/19 14:08:08","12/06/19 14:08:08",3021000,0,"FALSE",NA,NA,NA,NA,2019-12-06,50.35
"Gehen",98,233,2714000,2714000,4018,"12/07/19 15:22:47","12/07/19 14:09:32","12/07/19 14:09:32",2714000,3.048,"FALSE",NA,NA,NA,NA,2019-12-07,45.23
"Laufen",144,409,2721000,2588000,6573,"12/07/19 16:08:44","12/07/19 15:23:06","12/07/19 15:23:06",2721000,2.743,"FALSE",4.277421,"Kilometer",5.82948222565688,617.550557776054,2019-12-07,45.35
"Gehen",NA,49,1500000,1500000,1440,"12/07/19 19:51:10","12/07/19 19:19:00","12/07/19 19:19:00",1500000,0,"FALSE",1,"Kilometer",2.4,1500,2019-12-07,25
"Gehen",97,215,2458000,2458000,3697,"12/08/19 08:41:55","12/08/19 07:48:36","12/08/19 07:48:36",2458000,1.727,"FALSE",NA,NA,NA,NA,2019-12-08,40.97
"Laufen",143,315,2049000,1983000,5190,"12/08/19 09:15:30","12/08/19 08:41:08","12/08/19 08:41:08",2049000,1.524,"FALSE",3.216085,"Kilometer",5.6944447806354,632.195084627426,2019-12-08,34.15
"Gehen",102,137,1587000,1587000,2296,"12/09/19 12:57:35","12/09/19 06:56:15","12/09/19 06:56:15",1587000,0,"FALSE",NA,NA,NA,NA,2019-12-09,26.45
"Gehen",86,208,3072000,3072000,3028,"12/09/19 12:57:36","12/09/19 09:58:53","12/09/19 09:58:53",3072000,3.048,"FALSE",NA,NA,NA,NA,2019-12-09,51.2
"Gehen",100,218,2457000,2457000,3694,"12/09/19 17:32:49","12/09/19 14:25:08","12/09/19 14:25:08",2457000,0,"FALSE",NA,NA,NA,NA,2019-12-09,40.95
"Gehen",95,140,1741000,1741000,2329,"12/09/19 21:51:14","12/09/19 18:41:16","12/09/19 18:41:16",1741000,0,"FALSE",NA,NA,NA,NA,2019-12-09,29.02
"Gehen",103,145,1587000,1587000,2452,"12/10/19 13:26:47","12/10/19 07:48:54","12/10/19 07:48:54",1587000,0,"FALSE",NA,NA,NA,NA,2019-12-10,26.45
"Gehen",94,213,2509000,2509000,3684,"12/10/19 19:23:32","12/10/19 14:42:07","12/10/19 14:42:07",2509000,0,"FALSE",NA,NA,NA,NA,2019-12-10,41.82
"Gehen",100,104,1228000,1228000,1700,"12/10/19 20:16:09","12/10/19 19:52:45","12/10/19 19:52:45",1228000,0,"FALSE",NA,NA,NA,NA,2019-12-10,20.47
"Gehen",97,97,1126000,1126000,1656,"12/11/19 21:36:46","12/11/19 07:43:34","12/11/19 07:43:34",1126000,0,"FALSE",NA,NA,NA,NA,2019-12-11,18.77
"Gehen",102,225,2406000,2406000,3934,"12/11/19 21:36:46","12/11/19 14:40:51","12/11/19 14:40:51",2406000,0,"FALSE",NA,NA,NA,NA,2019-12-11,40.1
"Gehen",102,110,1229000,1229000,1821,"12/11/19 21:36:47","12/11/19 18:46:36","12/11/19 18:46:36",1229000,0,"FALSE",NA,NA,NA,NA,2019-12-11,20.48
"Gehen",97,135,1741000,1741000,2029,"12/12/19 12:51:06","12/12/19 08:14:43","12/12/19 08:14:43",1741000,0,"FALSE",NA,NA,NA,NA,2019-12-12,29.02
"Gehen",95,215,2458000,2458000,3728,"12/12/19 18:13:41","12/12/19 14:12:16","12/12/19 14:12:16",2458000,0,"FALSE",NA,NA,NA,NA,2019-12-12,40.97
"Gehen",104,133,1485000,1485000,2156,"12/12/19 19:18:04","12/12/19 18:43:38","12/12/19 18:43:38",1485000,0,"FALSE",NA,NA,NA,NA,2019-12-12,24.75
"Gehen",104,238,2560000,2560000,3975,"12/13/19 18:20:58","12/13/19 14:44:17","12/13/19 14:44:17",2560000,0,"FALSE",NA,NA,NA,NA,2019-12-13,42.67
"Training",131,470,3714000,3712000,4562,"12/13/19 18:20:58","12/13/19 16:08:36","12/13/19 16:08:36",3714000,6.401,"FALSE",NA,NA,NA,NA,2019-12-13,61.9
"Gehen",100,126,1484000,1484000,1905,"12/13/19 19:28:50","12/13/19 18:46:38","12/13/19 18:46:38",1484000,1.117,"FALSE",NA,NA,NA,NA,2019-12-13,24.73
"Gehen",106,131,1434000,1434000,2073,"12/14/19 13:10:14","12/14/19 07:49:59","12/14/19 07:49:59",1434000,0,"FALSE",NA,NA,NA,NA,2019-12-14,23.9
"Gehen",100,114,1178000,1178000,1978,"12/14/19 18:20:30","12/14/19 15:04:55","12/14/19 15:04:55",1178000,3.048,"FALSE",NA,NA,NA,NA,2019-12-14,19.63
"Gehen",102,118,1382000,1382000,1835,"12/14/19 20:25:53","12/14/19 18:50:12","12/14/19 18:50:12",1382000,0,"FALSE",NA,NA,NA,NA,2019-12-14,23.03
"Gehen",104,146,1588000,1588000,2288,"12/15/19 09:53:52","12/15/19 07:46:44","12/15/19 07:46:44",1588000,0,"FALSE",NA,NA,NA,NA,2019-12-15,26.47
"Laufen",144,407,2600000,2556000,6631,"12/15/19 10:40:31","12/15/19 09:52:37","12/15/19 09:52:37",2600000,2.438,"FALSE",5.166343,"Kilometer",7.18581690140845,500.986881435065,2019-12-15,43.33
"Gehen",115,200,1740000,1740000,2807,"12/15/19 18:13:16","12/15/19 13:58:48","12/15/19 13:58:48",1740000,2.438,"FALSE",NA,NA,NA,NA,2019-12-15,29
"Gehen",102,118,1434000,1434000,1867,"12/15/19 19:11:37","12/15/19 18:35:16","12/15/19 18:35:16",1434000,0,"FALSE",NA,NA,NA,NA,2019-12-15,23.9
"Gehen",100,220,2509000,2509000,3832,"12/16/19 20:40:21","12/16/19 15:15:11","12/16/19 15:15:11",2509000,0,"FALSE",NA,NA,NA,NA,2019-12-16,41.82
"Gehen",101,143,1587000,1587000,2396,"12/16/19 20:40:22","12/16/19 18:40:50","12/16/19 18:40:50",1587000,0,"FALSE",NA,NA,NA,NA,2019-12-16,26.45
"Gehen",101,326,3584000,3584000,5577,"12/17/19 16:13:47","12/17/19 14:27:50","12/17/19 14:27:50",3584000,0,"FALSE",NA,NA,NA,NA,2019-12-17,59.73
"Laufen",142,354,2719000,2301000,5955,"12/17/19 16:58:33","12/17/19 16:12:19","12/17/19 16:12:19",2719000,2.134,"FALSE",4.439734,"Kilometer",6.8463520208605,525.827475571075,2019-12-17,45.32
"Gehen",101,121,1434000,1434000,1821,"12/17/19 20:16:53","12/17/19 18:43:50","12/17/19 18:43:50",1434000,0,"FALSE",NA,NA,NA,NA,2019-12-17,23.9
"Gehen",93,124,1485000,1485000,2047,"12/18/19 12:35:08","12/18/19 07:46:21","12/18/19 07:46:21",1485000,0,"FALSE",NA,NA,NA,NA,2019-12-18,24.75
"Gehen",98,311,3994000,3994000,4718,"12/18/19 19:30:08","12/18/19 14:11:12","12/18/19 14:11:12",3994000,0,"FALSE",NA,NA,NA,NA,2019-12-18,66.57
"Gehen",99,124,1433000,1433000,1978,"12/18/19 19:30:09","12/18/19 18:43:26","12/18/19 18:43:26",1433000,0.965,"FALSE",NA,NA,NA,NA,2019-12-18,23.88
"Gehen",103,144,1792000,1792000,2191,"12/19/19 08:36:33","12/19/19 07:51:03","12/19/19 07:51:03",1792000,2.794,"FALSE",NA,NA,NA,NA,2019-12-19,29.87
"Laufen",143,443,2958000,2756000,7399,"12/19/19 09:25:22","12/19/19 08:35:48","12/19/19 08:35:48",2958000,4.267,"FALSE",5.248585,"Kilometer",6.63297387518142,542.742978902737,2019-12-19,49.3
"Gehen",101,210,2355000,2355000,3663,"12/19/19 17:27:51","12/19/19 14:15:03","12/19/19 14:15:03",2355000,0,"FALSE",NA,NA,NA,NA,2019-12-19,39.25
"Gehen",103,132,1433000,1433000,2243,"12/20/19 14:43:05","12/20/19 07:46:22","12/20/19 07:46:22",1433000,21.336,"FALSE",NA,NA,NA,NA,2019-12-20,23.88
"Gehen",96,161,1997000,1997000,2629,"12/20/19 20:34:38","12/20/19 18:41:50","12/20/19 18:41:50",1997000,9.144,"FALSE",NA,NA,NA,NA,2019-12-20,33.28
"Gehen",104,173,1843000,1843000,2922,"12/21/19 15:26:56","12/21/19 14:40:47","12/21/19 14:40:47",1843000,0,"FALSE",NA,NA,NA,NA,2019-12-21,30.72
"Gehen",102,142,1741000,1741000,2218,"12/21/19 20:22:08","12/21/19 18:37:09","12/21/19 18:37:09",1741000,0,"FALSE",NA,NA,NA,NA,2019-12-21,29.02
"Gehen",104,226,2457000,2457000,3865,"12/22/19 14:57:00","12/22/19 14:02:49","12/22/19 14:02:49",2457000,0,"FALSE",NA,NA,NA,NA,2019-12-22,40.95
"Gehen",97,118,1434000,1434000,1973,"12/22/19 21:16:42","12/22/19 18:45:16","12/22/19 18:45:16",1434000,0,"FALSE",NA,NA,NA,NA,2019-12-22,23.9
"Gehen",103,247,2867000,2867000,4114,"12/23/19 21:19:37","12/23/19 14:28:50","12/23/19 14:28:50",2867000,9.144,"FALSE",NA,NA,NA,NA,2019-12-23,47.78
"Gehen",95,138,1638000,1638000,2281,"12/23/19 21:19:37","12/23/19 18:44:51","12/23/19 18:44:51",1638000,15.24,"FALSE",NA,NA,NA,NA,2019-12-23,27.3
"Gehen",100,116,1280000,1280000,2035,"12/24/19 08:56:43","12/24/19 07:37:59","12/24/19 07:37:59",1280000,0,"FALSE",NA,NA,NA,NA,2019-12-24,21.33
"Gehen",98,238,2765000,2765000,4127,"12/25/19 05:51:50","12/24/19 14:21:36","12/24/19 14:21:36",2765000,0,"FALSE",NA,NA,NA,NA,2019-12-25,46.08
"Gehen",99,104,1126000,1126000,1774,"12/25/19 05:51:50","12/24/19 19:22:50","12/24/19 19:22:50",1126000,0,"FALSE",NA,NA,NA,NA,2019-12-25,18.77
"Gehen",102,188,2253000,2253000,3154,"12/25/19 21:11:59","12/25/19 15:10:40","12/25/19 15:10:40",2253000,0,"FALSE",NA,NA,NA,NA,2019-12-25,37.55
"Gehen",97,101,1280000,1280000,1720,"12/25/19 21:12:00","12/25/19 18:42:18","12/25/19 18:42:18",1280000,0,"FALSE",NA,NA,NA,NA,2019-12-25,21.33
"Gehen",101,244,2919000,2919000,4163,"12/26/19 16:29:46","12/26/19 15:23:36","12/26/19 15:23:36",2919000,0,"FALSE",NA,NA,NA,NA,2019-12-26,48.65
"Gehen",100,153,1792000,1792000,2563,"12/26/19 19:26:15","12/26/19 18:42:26","12/26/19 18:42:26",1792000,0,"FALSE",NA,NA,NA,NA,2019-12-26,29.87
"Gehen",107,227,2355000,2355000,3949,"12/27/19 19:39:12","12/27/19 15:07:50","12/27/19 15:07:50",2355000,0,"FALSE",NA,NA,NA,NA,2019-12-27,39.25
"Gehen",101,135,1638000,1638000,2138,"12/27/19 19:39:12","12/27/19 18:59:56","12/27/19 18:59:56",1638000,0,"FALSE",NA,NA,NA,NA,2019-12-27,27.3
"Gehen",110,118,1280000,1280000,1944,"12/28/19 12:49:56","12/28/19 07:52:12","12/28/19 07:52:12",1280000,3.048,"FALSE",NA,NA,NA,NA,2019-12-28,21.33
"Gehen",107,232,2560000,2560000,3918,"12/28/19 15:05:56","12/28/19 14:10:14","12/28/19 14:10:14",2560000,3.048,"FALSE",NA,NA,NA,NA,2019-12-28,42.67
"Gehen",102,115,1331000,1331000,1965,"12/28/19 19:20:11","12/28/19 18:46:43","12/28/19 18:46:43",1331000,0,"FALSE",NA,NA,NA,NA,2019-12-28,22.18
"Gehen",109,123,1331000,1331000,2106,"12/29/19 13:01:00","12/29/19 07:51:48","12/29/19 07:51:48",1331000,3.048,"FALSE",NA,NA,NA,NA,2019-12-29,22.18
"Gehen",108,236,2508000,2508000,3993,"12/29/19 15:16:55","12/29/19 14:24:20","12/29/19 14:24:20",2508000,3.048,"FALSE",NA,NA,NA,NA,2019-12-29,41.8
"Laufen",142,386,2660000,2512000,6580,"12/29/19 16:10:45","12/29/19 15:24:32","12/29/19 15:24:32",2660000,2.134,"FALSE",5.092242,"Kilometer",7.29712261146497,493.345143240955,2019-12-29,44.33
"Gehen",105,136,1587000,1587000,2194,"12/29/19 21:13:42","12/29/19 18:42:02","12/29/19 18:42:02",1587000,0,"FALSE",NA,NA,NA,NA,2019-12-29,26.45
"Gehen",101,116,1433000,1433000,1895,"12/30/19 19:36:21","12/30/19 07:40:17","12/30/19 07:40:17",1433000,3.048,"FALSE",NA,NA,NA,NA,2019-12-30,23.88
"Gehen",104,218,2406000,2406000,3784,"12/30/19 19:36:21","12/30/19 14:27:19","12/30/19 14:27:19",2406000,0,"FALSE",NA,NA,NA,NA,2019-12-30,40.1
"Gehen",103,124,1485000,1485000,1966,"12/30/19 19:36:22","12/30/19 18:22:50","12/30/19 18:22:50",1485000,0,"FALSE",NA,NA,NA,NA,2019-12-30,24.75
"Gehen",105,220,2458000,2458000,3831,"12/31/19 15:19:47","12/31/19 14:29:28","12/31/19 14:29:28",2458000,0,"FALSE",NA,NA,NA,NA,2019-12-31,40.97
"Laufen",145,389,2612000,2475000,6521,"12/31/19 16:07:14","12/31/19 15:23:28","12/31/19 15:23:28",2612000,5.486,"FALSE",5.132164,"Kilometer",7.3984,486.59169550173,2019-12-31,43.53
"Gehen",103,198,2304000,2304000,3378,"01/01/20 15:14:31","01/01/20 14:22:20","01/01/20 14:22:20",2304000,5.283,"FALSE",NA,NA,NA,NA,2020-01-01,38.4
"Gehen",98,111,1383000,1383000,1793,"01/01/20 21:19:34","01/01/20 18:40:53","01/01/20 18:40:53",1383000,0,"FALSE",NA,NA,NA,NA,2020-01-01,23.05
"Gehen",103,115,1331000,1331000,1981,"01/02/20 19:52:28","01/02/20 07:48:31","01/02/20 07:48:31",1331000,0,"FALSE",NA,NA,NA,NA,2020-01-02,22.18
"Gehen",105,221,2457000,2457000,3858,"01/02/20 19:52:28","01/02/20 14:12:31","01/02/20 14:12:31",2457000,0,"FALSE",NA,NA,NA,NA,2020-01-02,40.95
"Gehen",104,95,1178000,1178000,1620,"01/02/20 19:52:28","01/02/20 18:42:10","01/02/20 18:42:10",1178000,0,"FALSE",NA,NA,NA,NA,2020-01-02,19.63
"Gehen",102,132,1587000,1587000,2188,"01/03/20 19:26:37","01/03/20 18:45:10","01/03/20 18:45:10",1587000,3.048,"FALSE",NA,NA,NA,NA,2020-01-03,26.45
"Gehen",106,226,2509000,2509000,3941,"01/04/20 21:05:04","01/04/20 14:13:24","01/04/20 14:13:24",2509000,6.756,"FALSE",NA,NA,NA,NA,2020-01-04,41.82
"Gehen",107,115,1382000,1382000,1814,"01/04/20 21:05:05","01/04/20 18:43:55","01/04/20 18:43:55",1382000,18.288,"FALSE",NA,NA,NA,NA,2020-01-04,23.03
"Gehen",106,221,2458000,2458000,3855,"01/05/20 15:07:14","01/05/20 14:12:08","01/05/20 14:12:08",2458000,0,"FALSE",NA,NA,NA,NA,2020-01-05,40.97
"Gehen",100,138,1741000,1741000,2236,"01/05/20 20:44:38","01/05/20 18:41:47","01/05/20 18:41:47",1741000,0,"FALSE",NA,NA,NA,NA,2020-01-05,29.02
"Gehen",105,171,1946000,1946000,3037,"01/06/20 15:32:33","01/06/20 14:39:02","01/06/20 14:39:02",1946000,0,"FALSE",NA,NA,NA,NA,2020-01-06,32.43
"Gehen",101,128,1588000,1588000,2203,"01/06/20 20:10:12","01/06/20 18:43:05","01/06/20 18:43:05",1588000,0,"FALSE",NA,NA,NA,NA,2020-01-06,26.47
"Gehen",105,219,2509000,2509000,3857,"01/07/20 18:13:48","01/07/20 14:24:06","01/07/20 14:24:06",2509000,0,"FALSE",NA,NA,NA,NA,2020-01-07,41.82
"Gehen",96,116,1485000,1485000,1903,"01/07/20 19:14:34","01/07/20 18:42:40","01/07/20 18:42:40",1485000,0,"FALSE",NA,NA,NA,NA,2020-01-07,24.75
"Gehen",103,113,1331000,1331000,1865,"01/08/20 13:17:53","01/08/20 07:37:32","01/08/20 07:37:32",1331000,0,"FALSE",NA,NA,NA,NA,2020-01-08,22.18
"Gehen",103,232,2714000,2714000,4058,"01/08/20 15:04:45","01/08/20 14:13:29","01/08/20 14:13:29",2714000,0,"FALSE",NA,NA,NA,NA,2020-01-08,45.23
"Laufen",142,347,2673000,2331000,6244,"01/08/20 15:55:05","01/08/20 15:08:56","01/08/20 15:08:56",2673000,0.914,"FALSE",4.900984,"Kilometer",7.46937451737452,481.968067289441,2020-01-08,44.55
"Gehen",118,148,1484000,1484000,2178,"01/08/20 20:58:54","01/08/20 18:45:42","01/08/20 18:45:42",1484000,0,"FALSE",NA,NA,NA,NA,2020-01-08,24.73
"Gehen",107,210,2457000,2457000,3545,"01/09/20 18:17:54","01/09/20 14:01:07","01/09/20 14:01:07",2457000,3.048,"FALSE",NA,NA,NA,NA,2020-01-09,40.95
"Gehen",103,128,1536000,1536000,2105,"01/09/20 19:31:45","01/09/20 18:44:25","01/09/20 18:44:25",1536000,0,"FALSE",NA,NA,NA,NA,2020-01-09,25.6
"Gehen",110,208,2151000,2151000,3761,"01/10/20 16:02:33","01/10/20 14:57:00","01/10/20 14:57:00",2151000,0,"FALSE",NA,NA,NA,NA,2020-01-10,35.85
"Gehen",102,118,1434000,1434000,1973,"01/10/20 19:24:20","01/10/20 18:44:00","01/10/20 18:44:00",1434000,3.048,"FALSE",NA,NA,NA,NA,2020-01-10,23.9
"Gehen",109,124,1331000,1331000,2196,"01/11/20 10:21:48","01/11/20 07:40:33","01/11/20 07:40:33",1331000,0,"FALSE",NA,NA,NA,NA,2020-01-11,22.18
"Laufen",149,356,2426000,2246000,6046,"01/11/20 19:27:08","01/11/20 10:22:48","01/11/20 10:22:48",2426000,2.438,"FALSE",4.943296,"Kilometer",7.87215494211932,457.308072118664,2020-01-11,40.43
"Gehen",107,198,2253000,2253000,3392,"01/11/20 15:02:46","01/11/20 14:12:13","01/11/20 14:12:13",2253000,3.048,"FALSE",NA,NA,NA,NA,2020-01-11,37.55
"Gehen",101,191,2355000,2355000,3142,"01/11/20 19:24:42","01/11/20 18:37:37","01/11/20 18:37:37",2355000,0,"FALSE",NA,NA,NA,NA,2020-01-11,39.25
"Gehen",106,131,1485000,1485000,2202,"01/12/20 12:10:22","01/12/20 07:53:46","01/12/20 07:53:46",1485000,0,"FALSE",NA,NA,NA,NA,2020-01-12,24.75
"Laufband",139,276,2121000,2114000,3376,"01/12/20 12:10:19","01/12/20 10:05:13","01/12/20 10:05:13",2121000,3.658,"FALSE",2.208125,"Kilometer",3.76029706717124,NA,2020-01-12,35.35
"Gehen",106,152,1895000,1895000,2384,"01/12/20 19:22:45","01/12/20 14:08:23","01/12/20 14:08:23",1895000,0,"FALSE",NA,NA,NA,NA,2020-01-12,31.58
"Gehen",103,133,1690000,1690000,2120,"01/12/20 19:22:46","01/12/20 18:41:27","01/12/20 18:41:27",1690000,0,"FALSE",NA,NA,NA,NA,2020-01-12,28.17
"Gehen",107,216,2407000,2407000,3655,"01/13/20 18:27:32","01/13/20 14:19:04","01/13/20 14:19:04",2407000,0,"FALSE",NA,NA,NA,NA,2020-01-13,40.12
"Gehen",102,170,1997000,1997000,2858,"01/13/20 20:28:17","01/13/20 18:43:36","01/13/20 18:43:36",1997000,0,"FALSE",NA,NA,NA,NA,2020-01-13,33.28
"Gehen",105,134,1536000,1536000,2222,"01/16/20 22:55:40","01/14/20 07:40:59","01/14/20 07:40:59",1536000,0,"FALSE",NA,NA,NA,NA,2020-01-16,25.6
"Gehen",108,211,2253000,2253000,3658,"01/16/20 22:55:41","01/14/20 14:10:58","01/14/20 14:10:58",2253000,0,"FALSE",NA,NA,NA,NA,2020-01-16,37.55
"Gehen",99,120,1536000,1536000,1948,"01/16/20 22:55:41","01/14/20 18:46:36","01/14/20 18:46:36",1536000,0,"FALSE",NA,NA,NA,NA,2020-01-16,25.6
"Gehen",105,132,1382000,1382000,2303,"01/15/20 20:51:19","01/15/20 07:43:59","01/15/20 07:43:59",1382000,0,"FALSE",NA,NA,NA,NA,2020-01-15,23.03
"Gehen",111,127,1331000,1331000,2152,"01/22/20 14:55:46","01/15/20 14:55:47","01/15/20 14:55:47",1331000,3.048,"FALSE",NA,NA,NA,NA,2020-01-22,22.18
"Gehen",103,148,1792000,1792000,2474,"01/15/20 20:51:20","01/15/20 18:47:02","01/15/20 18:47:02",1792000,3.048,"FALSE",NA,NA,NA,NA,2020-01-15,29.87
"Gehen",105,130,1485000,1485000,2146,"01/16/20 17:17:44","01/16/20 08:05:45","01/16/20 08:05:45",1485000,0,"FALSE",NA,NA,NA,NA,2020-01-16,24.75
"Gehen",107,245,2918000,2918000,3939,"01/16/20 20:43:55","01/16/20 14:13:33","01/16/20 14:13:33",2918000,3.048,"FALSE",NA,NA,NA,NA,2020-01-16,48.63
"Gehen",102,146,1690000,1690000,2406,"01/16/20 20:43:55","01/16/20 18:38:56","01/16/20 18:38:56",1690000,0,"FALSE",NA,NA,NA,NA,2020-01-16,28.17
"Gehen",112,90,973000,973000,1443,"01/17/20 03:09:31","01/17/20 02:46:12","01/17/20 02:46:12",973000,12.192,"FALSE",NA,NA,NA,NA,2020-01-17,16.22
"Gehen",109,228,2457000,2457000,3886,"01/17/20 20:48:28","01/17/20 14:27:39","01/17/20 14:27:39",2457000,0,"FALSE",NA,NA,NA,NA,2020-01-17,40.95
"Gehen",107,134,1587000,1587000,2147,"01/17/20 20:48:28","01/17/20 18:40:14","01/17/20 18:40:14",1587000,0,"FALSE",NA,NA,NA,NA,2020-01-17,26.45
"Gehen",109,189,1996000,1996000,3389,"01/19/20 21:13:58","01/19/20 15:19:44","01/19/20 15:19:44",1996000,3.048,"FALSE",NA,NA,NA,NA,2020-01-19,33.27
"Gehen",104,113,1434000,1434000,1780,"01/19/20 21:13:59","01/19/20 18:46:14","01/19/20 18:46:14",1434000,0,"FALSE",NA,NA,NA,NA,2020-01-19,23.9
"Gehen",102,137,1638000,1638000,2374,"01/20/20 19:17:17","01/20/20 18:41:40","01/20/20 18:41:40",1638000,0,"FALSE",NA,NA,NA,NA,2020-01-20,27.3
"Gehen",107,147,1741000,1741000,2323,"01/21/20 21:20:09","01/21/20 07:51:00","01/21/20 07:51:00",1741000,3.048,"FALSE",NA,NA,NA,NA,2020-01-21,29.02
"Gehen",108,201,2202000,2202000,3463,"01/21/20 21:20:09","01/21/20 14:42:19","01/21/20 14:42:19",2202000,0,"FALSE",NA,NA,NA,NA,2020-01-21,36.7
"Gehen",103,128,1536000,1536000,1988,"01/21/20 21:20:09","01/21/20 18:50:38","01/21/20 18:50:38",1536000,0,"FALSE",NA,NA,NA,NA,2020-01-21,25.6
"Gehen",104,120,1434000,1434000,1951,"01/23/20 05:21:24","01/22/20 07:51:26","01/22/20 07:51:26",1434000,0,"FALSE",NA,NA,NA,NA,2020-01-23,23.9
"Gehen",110,216,2304000,2304000,3709,"01/23/20 05:21:24","01/22/20 14:15:26","01/22/20 14:15:26",2304000,3.048,"FALSE",NA,NA,NA,NA,2020-01-23,38.4
"Gehen",104,129,1588000,1588000,2134,"01/23/20 05:21:25","01/22/20 18:49:21","01/22/20 18:49:21",1588000,0,"FALSE",NA,NA,NA,NA,2020-01-23,26.47
"Gehen",105,252,3379000,3379000,3982,"01/23/20 15:28:50","01/23/20 14:22:40","01/23/20 14:22:40",3379000,0,"FALSE",NA,NA,NA,NA,2020-01-23,56.32
"Gehen",107,167,1895000,1895000,2696,"10/18/20 18:17:27","10/18/20 17:38:19","10/18/20 17:38:19",1895000,0,"TRUE",NA,NA,NA,NA,2020-10-18,31.58
"Gehen",102,123,1382000,1382000,1986,"10/19/20 07:02:07","10/19/20 06:25:29","10/19/20 06:25:29",1382000,0,"TRUE",NA,NA,NA,NA,2020-10-19,23.03
"Gehen",101,240,2508000,2508000,4132,"10/19/20 14:04:47","10/19/20 13:09:58","10/19/20 13:09:58",2508000,2.336,"TRUE",NA,NA,NA,NA,2020-10-19,41.8
"Gehen",107,164,1741000,1741000,2709,"10/19/20 18:26:09","10/19/20 17:40:28","10/19/20 17:40:28",1741000,0,"TRUE",NA,NA,NA,NA,2020-10-19,29.02
"Gehen",104,239,2560000,2560000,4036,"10/20/20 14:08:17","10/20/20 12:55:54","10/20/20 12:55:54",2560000,15.24,"TRUE",NA,NA,NA,NA,2020-10-20,42.67
"Gehen",124,556,5036000,4362000,9376,"10/20/20 15:32:46","10/20/20 14:08:27","10/20/20 14:08:27",5036000,8.23,"TRUE",7.542367,"Kilometer",6.22544979367263,578.271469422007,2020-10-20,83.93
"Gehen",107,111,1228000,1228000,1839,"10/20/20 18:15:53","10/20/20 17:32:23","10/20/20 17:32:23",1228000,9.144,"TRUE",NA,NA,NA,NA,2020-10-20,20.47
"Gehen",110,140,1485000,1485000,2327,"10/21/20 07:05:04","10/21/20 06:22:05","10/21/20 06:22:05",1485000,0,"TRUE",NA,NA,NA,NA,2020-10-21,24.75
"Gehen",106,213,2253000,2253000,3737,"10/21/20 13:51:43","10/21/20 13:07:25","10/21/20 13:07:25",2253000,0,"TRUE",NA,NA,NA,NA,2020-10-21,37.55
"Gehen",100,144,1690000,1690000,2342,"10/21/20 18:19:13","10/21/20 17:35:22","10/21/20 17:35:22",1690000,0,"TRUE",NA,NA,NA,NA,2020-10-21,28.17
"Gehen",100,148,1690000,1690000,2463,"10/22/20 10:46:34","10/22/20 06:24:14","10/22/20 06:24:14",1690000,0,"TRUE",NA,NA,NA,NA,2020-10-22,28.17
"Gehen",103,239,2611000,2611000,4024,"10/22/20 14:03:33","10/22/20 13:10:25","10/22/20 13:10:25",2611000,0,"TRUE",NA,NA,NA,NA,2020-10-22,43.52
"Gehen",115,468,4745000,4170000,8177,"10/22/20 15:34:18","10/22/20 14:04:15","10/22/20 14:04:15",4745000,11.278,"TRUE",6.602132,"Kilometer",5.69968057553957,631.614342643965,2020-10-22,79.08
"Gehen",111,181,1946000,1946000,2854,"10/22/20 18:15:37","10/22/20 17:33:15","10/22/20 17:33:15",1946000,0,"TRUE",NA,NA,NA,NA,2020-10-22,32.43
"Gehen",111,155,1587000,1587000,2539,"10/23/20 06:51:56","10/23/20 06:09:19","10/23/20 06:09:19",1587000,0,"TRUE",NA,NA,NA,NA,2020-10-23,26.45
"Gehen",106,212,2151000,2151000,3690,"10/23/20 13:57:54","10/23/20 13:10:00","10/23/20 13:10:00",2151000,0,"TRUE",NA,NA,NA,NA,2020-10-23,35.85
"Gehen",101,149,1639000,1639000,2453,"10/23/20 18:19:46","10/23/20 17:43:55","10/23/20 17:43:55",1639000,0,"TRUE",NA,NA,NA,NA,2020-10-23,27.32
"Gehen",103,192,2048000,2048000,3252,"10/24/20 13:47:13","10/24/20 13:08:44","10/24/20 13:08:44",2048000,0,"TRUE",NA,NA,NA,NA,2020-10-24,34.13
"Training",111,140,1589000,1586000,2111,"10/24/20 15:17:26","10/24/20 14:48:00","10/24/20 14:48:00",1589000,0,"TRUE",NA,NA,NA,NA,2020-10-24,26.48
"Gehen",102,169,1894000,1894000,2824,"10/24/20 18:22:44","10/24/20 17:40:13","10/24/20 17:40:13",1894000,0,"TRUE",NA,NA,NA,NA,2020-10-24,31.57
"Gehen",105,128,1382000,1382000,2144,"10/25/20 07:55:11","10/25/20 07:28:49","10/25/20 07:28:49",1382000,0,"TRUE",NA,NA,NA,NA,2020-10-25,23.03
"Laufen",151,708,4319000,4183000,10964,"10/25/20 09:46:04","10/25/20 08:30:04","10/25/20 08:30:04",4319000,5.486,"TRUE",8.34864,"Kilometer",7.18419890031078,501.099712014414,2020-10-25,71.98
"Gehen",107,242,2509000,2509000,4030,"10/25/20 15:27:20","10/25/20 14:36:20","10/25/20 14:36:20",2509000,3.048,"TRUE",NA,NA,NA,NA,2020-10-25,41.82
"Gehen",100,194,2151000,2151000,3241,"10/25/20 19:09:03","10/25/20 18:25:53","10/25/20 18:25:53",2151000,0,"TRUE",NA,NA,NA,NA,2020-10-25,35.85
"Gehen",97,224,2612000,2612000,3637,"10/26/20 15:11:45","10/26/20 14:18:00","10/26/20 14:18:00",2612000,0,"TRUE",NA,NA,NA,NA,2020-10-26,43.53
"Radfahren im Freien",137,227,1843000,1843000,NA,"10/26/20 16:12:13","10/26/20 15:38:13","10/26/20 15:38:13",1843000,3.048,"TRUE",NA,NA,NA,NA,2020-10-26,30.72
"Gehen",105,170,1843000,1843000,2754,"10/26/20 19:21:00","10/26/20 18:40:50","10/26/20 18:40:50",1843000,3.048,"TRUE",NA,NA,NA,NA,2020-10-26,30.72
"Gehen",103,132,1485000,1485000,2196,"10/27/20 07:50:43","10/27/20 07:13:28","10/27/20 07:13:28",1485000,6.096,"TRUE",NA,NA,NA,NA,2020-10-27,24.75
"Gehen",104,228,2407000,2407000,3883,"10/27/20 15:09:24","10/27/20 14:11:37","10/27/20 14:11:37",2407000,9.144,"TRUE",NA,NA,NA,NA,2020-10-27,40.12
"Laufen",147,396,2750000,2429000,6346,"10/27/20 16:25:41","10/27/20 15:25:27","10/27/20 15:25:27",2750000,1.219,"TRUE",4.808781,"Kilometer",7.12970440510498,504.929769237325,2020-10-27,45.83
"Gehen",105,141,1536000,1536000,2257,"10/27/20 19:22:18","10/27/20 18:45:32","10/27/20 18:45:32",1536000,0,"TRUE",NA,NA,NA,NA,2020-10-27,25.6
"Gehen",104,144,1639000,1639000,2239,"10/28/20 07:27:32","10/28/20 06:56:51","10/28/20 06:56:51",1639000,3.048,"TRUE",NA,NA,NA,NA,2020-10-28,27.32
"Gehen",100,105,1383000,1383000,1498,"10/28/20 10:29:12","10/28/20 09:51:47","10/28/20 09:51:47",1383000,0,"TRUE",NA,NA,NA,NA,2020-10-28,23.05
"Gehen",100,258,3123000,3123000,4103,"10/28/20 15:05:09","10/28/20 14:10:21","10/28/20 14:10:21",3123000,0,"TRUE",NA,NA,NA,NA,2020-10-28,52.05
"Gehen",98,152,1741000,1741000,2497,"10/28/20 19:22:01","10/28/20 18:38:18","10/28/20 18:38:18",1741000,3.048,"TRUE",NA,NA,NA,NA,2020-10-28,29.02
"Gehen",105,143,1587000,1587000,2363,"10/29/20 07:30:17","10/29/20 06:56:26","10/29/20 06:56:26",1587000,0,"TRUE",NA,NA,NA,NA,2020-10-29,26.45
"Gehen",102,241,2611000,2611000,4071,"10/29/20 15:04:06","10/29/20 14:10:47","10/29/20 14:10:47",2611000,0,"TRUE",NA,NA,NA,NA,2020-10-29,43.52
"Training",128,449,3893000,3891000,4634,"10/29/20 16:54:53","10/29/20 15:49:44","10/29/20 15:49:44",3893000,15.24,"TRUE",NA,NA,NA,NA,2020-10-29,64.88
"Gehen",103,148,1689000,1689000,2429,"10/29/20 19:23:04","10/29/20 18:46:25","10/29/20 18:46:25",1689000,0,"TRUE",NA,NA,NA,NA,2020-10-29,28.15
"Gehen",104,140,1536000,1536000,2254,"10/30/20 08:10:34","10/30/20 07:26:46","10/30/20 07:26:46",1536000,0,"TRUE",NA,NA,NA,NA,2020-10-30,25.6
"Gehen",96,248,2817000,2817000,4143,"10/30/20 15:00:35","10/30/20 14:08:41","10/30/20 14:08:41",2817000,3.048,"TRUE",NA,NA,NA,NA,2020-10-30,46.95
"Gehen",105,159,1741000,1741000,2551,"10/30/20 19:15:41","10/30/20 18:37:30","10/30/20 18:37:30",1741000,0,"TRUE",NA,NA,NA,NA,2020-10-30,29.02
"Gehen",105,129,1383000,1383000,2183,"10/31/20 08:14:57","10/31/20 07:35:44","10/31/20 07:35:44",1383000,3.048,"TRUE",NA,NA,NA,NA,2020-10-31,23.05
"Laufen",144,485,3292000,3049000,7936,"10/31/20 11:25:49","10/31/20 10:24:45","10/31/20 10:24:45",3292000,2.438,"TRUE",6.232242,"Kilometer",7.35849918005904,489.23019652645,2020-10-31,54.87
"Gehen",107,233,2457000,2457000,3943,"10/31/20 15:04:22","10/31/20 14:08:17","10/31/20 14:08:17",2457000,0,"TRUE",NA,NA,NA,NA,2020-10-31,40.95
"Gehen",100,121,1331000,1331000,2057,"10/31/20 19:13:59","10/31/20 18:33:40","10/31/20 18:33:40",1331000,0,"TRUE",NA,NA,NA,NA,2020-10-31,22.18
"Gehen",105,148,1536000,1536000,2413,"11/01/20 08:14:44","11/01/20 07:34:29","11/01/20 07:34:29",1536000,0,"TRUE",NA,NA,NA,NA,2020-11-01,25.6
"Gehen",100,228,2355000,2355000,3955,"11/01/20 14:59:07","11/01/20 14:10:26","11/01/20 14:10:26",2355000,0,"TRUE",NA,NA,NA,NA,2020-11-01,39.25
"Gehen",98,143,1690000,1690000,2306,"11/01/20 19:26:13","11/01/20 18:44:21","11/01/20 18:44:21",1690000,0,"TRUE",NA,NA,NA,NA,2020-11-01,28.17
"Gehen",101,127,1485000,1485000,2014,"11/02/20 07:56:28","11/02/20 07:20:24","11/02/20 07:20:24",1485000,0,"TRUE",NA,NA,NA,NA,2020-11-02,24.75
"Laufen",146,707,4477000,4290000,11223,"11/02/20 11:14:38","11/02/20 09:58:50","11/02/20 09:58:50",4477000,5.486,"TRUE",8.453882,"Kilometer",7.09527272727273,507.380073800738,2020-11-02,74.62
"Gehen",103,264,2969000,2969000,4369,"11/02/20 15:25:47","11/02/20 14:21:07","11/02/20 14:21:07",2969000,0,"TRUE",NA,NA,NA,NA,2020-11-02,49.48
"Gehen",103,149,1639000,1639000,2329,"11/02/20 19:12:42","11/02/20 18:38:49","11/02/20 18:38:49",1639000,0,"TRUE",NA,NA,NA,NA,2020-11-02,27.32
"Gehen",96,124,1485000,1485000,2096,"11/03/20 08:01:32","11/03/20 07:25:07","11/03/20 07:25:07",1485000,0,"TRUE",NA,NA,NA,NA,2020-11-03,24.75
"Gehen",101,225,2612000,2612000,3700,"11/03/20 15:07:52","11/03/20 14:15:34","11/03/20 14:15:34",2612000,0,"TRUE",NA,NA,NA,NA,2020-11-03,43.53
"Gehen",101,119,1279000,1279000,1990,"11/03/20 19:24:59","11/03/20 18:40:58","11/03/20 18:40:58",1279000,0,"TRUE",NA,NA,NA,NA,2020-11-03,21.32
"Gehen",104,130,1433000,1433000,2125,"11/04/20 08:00:47","11/04/20 07:23:52","11/04/20 07:23:52",1433000,3.048,"TRUE",NA,NA,NA,NA,2020-11-04,23.88
"Gehen",103,231,2560000,2560000,3839,"11/04/20 15:13:29","11/04/20 14:13:27","11/04/20 14:13:27",2560000,6.096,"TRUE",NA,NA,NA,NA,2020-11-04,42.67
"Gehen",100,164,1894000,1894000,2737,"11/04/20 19:17:20","11/04/20 18:41:25","11/04/20 18:41:25",1894000,0,"TRUE",NA,NA,NA,NA,2020-11-04,31.57
"Gehen",104,124,1382000,1382000,2046,"11/05/20 07:49:35","11/05/20 07:23:27","11/05/20 07:23:27",1382000,3.048,"TRUE",NA,NA,NA,NA,2020-11-05,23.03
"Gehen",117,311,2662000,2662000,5434,"11/05/20 10:02:33","11/05/20 09:05:51","11/05/20 09:05:51",2662000,0,"TRUE",NA,NA,NA,NA,2020-11-05,44.37
"Radfahren im Freien",122,266,2304000,2304000,NA,"11/05/20 11:18:20","11/05/20 10:28:37","11/05/20 10:28:37",2304000,3.048,"TRUE",NA,NA,NA,NA,2020-11-05,38.4
"Gehen",105,244,2612000,2612000,4007,"11/05/20 14:56:30","11/05/20 14:09:38","11/05/20 14:09:38",2612000,6.096,"TRUE",NA,NA,NA,NA,2020-11-05,43.53
"Gehen",103,174,1946000,1946000,2884,"11/05/20 19:16:08","11/05/20 18:38:26","11/05/20 18:38:26",1946000,0,"TRUE",NA,NA,NA,NA,2020-11-05,32.43
"Gehen",105,150,1741000,1741000,2315,"11/06/20 08:02:07","11/06/20 07:23:02","11/06/20 07:23:02",1741000,3.2,"TRUE",NA,NA,NA,NA,2020-11-06,29.02
"Gehen",90,72,973000,973000,1092,"11/06/20 09:32:52","11/06/20 09:08:51","11/06/20 09:08:51",973000,0,"TRUE",NA,NA,NA,NA,2020-11-06,16.22
"Gehen",99,229,2509000,2509000,3863,"11/06/20 15:05:37","11/06/20 14:09:13","11/06/20 14:09:13",2509000,3.048,"TRUE",NA,NA,NA,NA,2020-11-06,41.82
"Gehen",101,133,1485000,1485000,2122,"11/06/20 21:02:58","11/06/20 18:40:35","11/06/20 18:40:35",1485000,0,"TRUE",NA,NA,NA,NA,2020-11-06,24.75
"Gehen",98,153,1740000,1740000,2545,"11/07/20 09:12:18","11/07/20 08:25:47","11/07/20 08:25:47",1740000,0,"TRUE",NA,NA,NA,NA,2020-11-07,29
"Gehen",98,234,2662000,2662000,3903,"11/07/20 15:02:25","11/07/20 14:11:23","11/07/20 14:11:23",2662000,0,"TRUE",NA,NA,NA,NA,2020-11-07,44.37
"Training",134,229,1864000,1862000,2112,"11/07/20 16:18:08","11/07/20 15:42:21","11/07/20 15:42:21",1864000,7.62,"TRUE",NA,NA,NA,NA,2020-11-07,31.07
"Gehen",102,152,1741000,1741000,2455,"11/07/20 19:21:46","11/07/20 18:44:27","11/07/20 18:44:27",1741000,0,"TRUE",NA,NA,NA,NA,2020-11-07,29.02
"Gehen",99,191,2202000,2202000,3171,"11/08/20 15:04:02","11/08/20 14:10:14","11/08/20 14:10:14",2202000,0,"TRUE",NA,NA,NA,NA,2020-11-08,36.7
"Gehen",101,138,1639000,1639000,2196,"11/08/20 19:18:55","11/08/20 18:48:25","11/08/20 18:48:25",1639000,0,"TRUE",NA,NA,NA,NA,2020-11-08,27.32
"Gehen",99,259,3124000,3124000,4238,"11/09/20 15:41:48","11/09/20 14:45:38","11/09/20 14:45:38",3124000,0,"TRUE",NA,NA,NA,NA,2020-11-09,52.07
"Gehen",98,169,2099000,2099000,2745,"11/09/20 19:29:51","11/09/20 18:40:19","11/09/20 18:40:19",2099000,0,"TRUE",NA,NA,NA,NA,2020-11-09,34.98
"Gehen",103,121,1382000,1382000,1964,"11/10/20 07:55:08","11/10/20 07:23:13","11/10/20 07:23:13",1382000,0,"TRUE",NA,NA,NA,NA,2020-11-10,23.03
"Laufen",145,686,5200000,4243000,11053,"11/10/20 10:16:36","11/10/20 08:45:45","11/10/20 08:45:45",5200000,4.572,"TRUE",8.248984,"Kilometer",6.99603111006363,514.577471621228,2020-11-10,86.67
"Gehen",105,242,2764000,2764000,3849,"11/10/20 17:38:40","11/10/20 14:11:06","11/10/20 14:11:06",2764000,0,"TRUE",NA,NA,NA,NA,2020-11-10,46.07
"Gehen",100,148,1741000,1741000,2416,"11/10/20 19:23:15","11/10/20 18:38:11","11/10/20 18:38:11",1741000,0,"TRUE",NA,NA,NA,NA,2020-11-10,29.02
"Gehen",102,237,2509000,2509000,4109,"11/11/20 15:02:07","11/11/20 14:03:51","11/11/20 14:03:51",2509000,3.048,"TRUE",NA,NA,NA,NA,2020-11-11,41.82
"Gehen",101,143,1689000,1689000,2315,"11/11/20 19:14:10","11/11/20 18:41:11","11/11/20 18:41:11",1689000,0,"TRUE",NA,NA,NA,NA,2020-11-11,28.15
"Gehen",98,240,2816000,2816000,4011,"11/12/20 15:11:29","11/12/20 14:10:15","11/12/20 14:10:15",2816000,0,"TRUE",NA,NA,NA,NA,2020-11-12,46.93
"Gehen",98,128,1484000,1484000,2091,"11/12/20 19:13:31","11/12/20 18:40:46","11/12/20 18:40:46",1484000,0,"TRUE",NA,NA,NA,NA,2020-11-12,24.73
"Gehen",102,139,1638000,1638000,2257,"11/13/20 07:56:39","11/13/20 07:24:30","11/13/20 07:24:30",1638000,0,"TRUE",NA,NA,NA,NA,2020-11-13,27.3
"Laufen",149,681,4050000,4042000,10667,"11/13/20 10:12:47","11/13/20 08:57:46","11/13/20 08:57:46",4050000,6.401,"TRUE",8.341429,"Kilometer",7.42771202375062,484.671455824991,2020-11-13,67.5
"Gehen",103,248,2714000,2714000,4138,"11/13/20 15:02:15","11/13/20 14:11:32","11/13/20 14:11:32",2714000,0,"TRUE",NA,NA,NA,NA,2020-11-13,45.23
"Yoga",84,2,9000,5000,4,"11/13/20 18:34:31","11/13/20 18:33:56","11/13/20 18:33:56",9000,0,"TRUE",NA,NA,NA,NA,2020-11-13,0.15
"Gehen",101,151,1741000,1741000,2448,"11/13/20 19:20:00","11/13/20 18:38:38","11/13/20 18:38:38",1741000,0,"TRUE",NA,NA,NA,NA,2020-11-13,29.02
"Gehen",103,145,1689000,1689000,2368,"11/14/20 08:08:12","11/14/20 07:27:31","11/14/20 07:27:31",1689000,0,"TRUE",NA,NA,NA,NA,2020-11-14,28.15
"Gehen",101,217,2406000,2406000,3674,"11/14/20 15:07:38","11/14/20 14:17:07","11/14/20 14:17:07",2406000,0,"TRUE",NA,NA,NA,NA,2020-11-14,40.1
"Gehen",103,176,2048000,2048000,2786,"11/14/20 19:30:19","11/14/20 18:39:57","11/14/20 18:39:57",2048000,0,"TRUE",NA,NA,NA,NA,2020-11-14,34.13
"Gehen",106,150,1587000,1587000,2457,"11/15/20 08:08:34","11/15/20 07:28:51","11/15/20 07:28:51",1587000,0,"TRUE",NA,NA,NA,NA,2020-11-15,26.45
"Ellipsentrainer",137,436,3504000,3301000,4793,"11/15/20 09:54:29","11/15/20 08:51:42","11/15/20 08:51:42",3504000,6.096,"TRUE",NA,NA,NA,NA,2020-11-15,58.4
"Gehen",101,232,2508000,2508000,3953,"11/15/20 15:42:21","11/15/20 14:51:44","11/15/20 14:51:44",2508000,0,"TRUE",NA,NA,NA,NA,2020-11-15,41.8
"Gehen",104,155,1741000,1741000,2537,"11/15/20 19:11:20","11/15/20 18:33:36","11/15/20 18:33:36",1741000,0,"TRUE",NA,NA,NA,NA,2020-11-15,29.02
"Gehen",104,138,1536000,1536000,2226,"11/16/20 07:56:29","11/16/20 07:25:53","11/16/20 07:25:53",1536000,0,"TRUE",NA,NA,NA,NA,2020-11-16,25.6
"Gehen",95,225,2765000,2765000,3798,"11/16/20 14:47:33","11/16/20 13:52:26","11/16/20 13:52:26",2765000,0,"TRUE",NA,NA,NA,NA,2020-11-16,46.08
"Gehen",98,153,1946000,1946000,2397,"11/16/20 19:20:39","11/16/20 18:40:01","11/16/20 18:40:01",1946000,0,"TRUE",NA,NA,NA,NA,2020-11-16,32.43
"Gehen",100,132,1587000,1587000,2151,"11/17/20 07:57:30","11/17/20 07:13:31","11/17/20 07:13:31",1587000,0,"TRUE",NA,NA,NA,NA,2020-11-17,26.45
"Gehen",115,464,4311000,4180000,8200,"11/17/20 10:13:38","11/17/20 09:00:14","11/17/20 09:00:14",4311000,18.288,"TRUE",6.563296,"Kilometer",5.65259425837321,636.875713247472,2020-11-17,71.85
"Gehen",98,235,2662000,2662000,3937,"11/17/20 15:00:05","11/17/20 14:11:39","11/17/20 14:11:39",2662000,0,"TRUE",NA,NA,NA,NA,2020-11-17,44.37
"Gehen",97,150,1792000,1792000,2462,"11/17/20 19:13:25","11/17/20 18:38:45","11/17/20 18:38:45",1792000,0,"TRUE",NA,NA,NA,NA,2020-11-17,29.87
"Gehen",106,125,1382000,1382000,2079,"11/18/20 07:49:39","11/18/20 07:16:31","11/18/20 07:16:31",1382000,0,"TRUE",NA,NA,NA,NA,2020-11-18,23.03
"Gehen",100,281,3124000,3124000,4811,"11/18/20 15:06:37","11/18/20 14:06:07","11/18/20 14:06:07",3124000,0,"TRUE",NA,NA,NA,NA,2020-11-18,52.07
"Gehen",101,155,1741000,1741000,2592,"11/18/20 20:55:57","11/18/20 18:36:38","11/18/20 18:36:38",1741000,0,"TRUE",NA,NA,NA,NA,2020-11-18,29.02
"Gehen",100,151,1741000,1741000,2476,"11/19/20 08:05:44","11/19/20 07:24:38","11/19/20 07:24:38",1741000,0,"TRUE",NA,NA,NA,NA,2020-11-19,29.02
"Gehen",115,468,4620000,4178000,8183,"11/19/20 09:51:40","11/19/20 08:30:34","11/19/20 08:30:34",4620000,12.802,"TRUE",6.500421,"Kilometer",5.60123121110579,642.71583591517,2020-11-19,77
"Gehen",96,248,2918000,2918000,4104,"11/19/20 15:00:56","11/19/20 14:09:07","11/19/20 14:09:07",2918000,0,"TRUE",NA,NA,NA,NA,2020-11-19,48.63
"Gehen",101,135,1536000,1536000,2264,"11/19/20 19:15:38","11/19/20 18:43:02","11/19/20 18:43:02",1536000,0,"TRUE",NA,NA,NA,NA,2020-11-19,25.6
"Gehen",107,151,1587000,1587000,2408,"11/20/20 08:02:37","11/20/20 07:19:57","11/20/20 07:19:57",1587000,0,"TRUE",NA,NA,NA,NA,2020-11-20,26.45
"Gehen",99,235,2560000,2560000,4076,"11/20/20 14:38:05","11/20/20 13:43:57","11/20/20 13:43:57",2560000,0,"TRUE",NA,NA,NA,NA,2020-11-20,42.67
"Training",120,421,4185000,4183000,4502,"11/20/20 16:52:57","11/20/20 15:33:51","11/20/20 15:33:51",4185000,7.62,"TRUE",NA,NA,NA,NA,2020-11-20,69.75
"Gehen",104,197,2253000,2253000,3025,"11/20/20 19:25:44","11/20/20 18:41:45","11/20/20 18:41:45",2253000,0,"TRUE",NA,NA,NA,NA,2020-11-20,37.55
"Gehen",100,137,1894000,1894000,2042,"11/21/20 08:14:42","11/21/20 07:28:04","11/21/20 07:28:04",1894000,0,"TRUE",NA,NA,NA,NA,2020-11-21,31.57
"Gehen",99,255,2919000,2919000,4308,"11/21/20 15:04:36","11/21/20 14:09:59","11/21/20 14:09:59",2919000,3.048,"TRUE",NA,NA,NA,NA,2020-11-21,48.65
"Gehen",104,144,1587000,1587000,2367,"11/21/20 19:09:48","11/21/20 18:40:30","11/21/20 18:40:30",1587000,0,"TRUE",NA,NA,NA,NA,2020-11-21,26.45
"Gehen",106,157,1740000,1740000,2534,"11/22/20 08:11:41","11/22/20 07:37:03","11/22/20 07:37:03",1740000,0,"TRUE",NA,NA,NA,NA,2020-11-22,29
"Training",139,750,5576000,5451000,7976,"11/22/20 10:51:20","11/22/20 09:04:23","11/22/20 09:04:23",5576000,7.925,"TRUE",NA,NA,NA,NA,2020-11-22,92.93
"Gehen",104,250,2765000,2765000,4165,"11/22/20 15:03:20","11/22/20 14:06:10","11/22/20 14:06:10",2765000,0,"TRUE",NA,NA,NA,NA,2020-11-22,46.08
"Gehen",102,175,2202000,2202000,2747,"11/22/20 19:24:30","11/22/20 18:40:05","11/22/20 18:40:05",2202000,0,"TRUE",NA,NA,NA,NA,2020-11-22,36.7
"Gehen",98,264,3021000,3021000,4560,"11/23/20 15:10:14","11/23/20 14:14:18","11/23/20 14:14:18",3021000,0,"TRUE",NA,NA,NA,NA,2020-11-23,50.35
"Gehen",99,161,1945000,1945000,2613,"11/23/20 19:27:17","11/23/20 18:39:42","11/23/20 18:39:42",1945000,0,"TRUE",NA,NA,NA,NA,2020-11-23,32.42
"Gehen",105,138,1536000,1536000,2133,"11/24/20 08:06:50","11/24/20 07:26:51","11/24/20 07:26:51",1536000,0,"TRUE",NA,NA,NA,NA,2020-11-24,25.6
"Gehen",103,261,3021000,3021000,4445,"11/24/20 15:10:51","11/24/20 14:09:38","11/24/20 14:09:38",3021000,0,"TRUE",NA,NA,NA,NA,2020-11-24,50.35
"Gehen",106,140,1587000,1587000,2242,"11/24/20 19:13:37","11/24/20 18:39:17","11/24/20 18:39:17",1587000,3.048,"TRUE",NA,NA,NA,NA,2020-11-24,26.45
"Gehen",99,195,2304000,2304000,3267,"11/25/20 14:57:34","11/25/20 14:16:54","11/25/20 14:16:54",2304000,0,"TRUE",NA,NA,NA,NA,2020-11-25,38.4
"Training",132,548,4603000,4420000,6153,"11/25/20 17:28:51","11/25/20 16:04:46","11/25/20 16:04:46",4603000,33.528,"TRUE",NA,NA,NA,NA,2020-11-25,76.72
"Gehen",107,167,1895000,1895000,2704,"11/25/20 19:14:43","11/25/20 18:38:01","11/25/20 18:38:01",1895000,3.048,"TRUE",NA,NA,NA,NA,2020-11-25,31.58
"Gehen",100,233,2560000,2560000,4006,"11/26/20 15:11:47","11/26/20 14:13:12","11/26/20 14:13:12",2560000,3.048,"TRUE",NA,NA,NA,NA,2020-11-26,42.67
"Laufen",143,468,3107000,2889000,7415,"11/26/20 16:42:33","11/26/20 15:45:17","11/26/20 15:45:17",3107000,3.353,"TRUE",5.60521,"Kilometer",6.98108411214953,515.679218609433,2020-11-26,51.78
"Gehen",104,160,1844000,1844000,2585,"11/26/20 19:25:06","11/26/20 18:40:18","11/26/20 18:40:18",1844000,3.048,"TRUE",NA,NA,NA,NA,2020-11-26,30.73
"Gehen",106,148,1638000,1638000,2350,"11/27/20 08:04:45","11/27/20 07:19:47","11/27/20 07:19:47",1638000,0,"TRUE",NA,NA,NA,NA,2020-11-27,27.3
"Gehen",101,326,3584000,3584000,5649,"11/27/20 15:17:43","11/27/20 14:13:38","11/27/20 14:13:38",3584000,3.048,"TRUE",NA,NA,NA,NA,2020-11-27,59.73
"Gehen",102,177,1997000,1997000,2899,"11/27/20 19:20:05","11/27/20 18:33:54","11/27/20 18:33:54",1997000,0,"TRUE",NA,NA,NA,NA,2020-11-27,33.28
"Gehen",102,166,2048000,2048000,2497,"11/28/20 08:14:36","11/28/20 07:27:03","11/28/20 07:27:03",2048000,3.048,"TRUE",NA,NA,NA,NA,2020-11-28,34.13
"Gehen",103,228,2509000,2509000,3962,"11/28/20 16:48:55","11/28/20 14:12:23","11/28/20 14:12:23",2509000,0,"TRUE",NA,NA,NA,NA,2020-11-28,41.82
"Gehen",101,179,2048000,2048000,2899,"11/28/20 19:22:56","11/28/20 18:36:55","11/28/20 18:36:55",2048000,0,"TRUE",NA,NA,NA,NA,2020-11-28,34.13
"Gehen",105,149,1638000,1638000,2446,"11/29/20 08:07:30","11/29/20 07:31:13","11/29/20 07:31:13",1638000,1.574,"TRUE",NA,NA,NA,NA,2020-11-29,27.3
"Laufen",151,598,3568000,3554000,9326,"11/29/20 09:23:06","11/29/20 08:10:28","11/29/20 08:10:28",3568000,7.925,"TRUE",7.130828,"Kilometer",7.22088688801351,498.553717269261,2020-11-29,59.47
"Gehen",102,238,2662000,2662000,4170,"11/29/20 14:50:38","11/29/20 13:58:38","11/29/20 13:58:38",2662000,0,"TRUE",NA,NA,NA,NA,2020-11-29,44.37
"Gehen",103,144,1587000,1587000,2468,"11/29/20 21:49:57","11/29/20 18:42:48","11/29/20 18:42:48",1587000,0,"TRUE",NA,NA,NA,NA,2020-11-29,26.45
"Gehen",99,146,1844000,1844000,2368,"11/30/20 08:08:51","11/30/20 07:29:05","11/30/20 07:29:05",1844000,3.048,"TRUE",NA,NA,NA,NA,2020-11-30,30.73
"Gehen",100,288,3225000,3225000,5007,"11/30/20 15:15:15","11/30/20 14:07:36","11/30/20 14:07:36",3225000,3.048,"TRUE",NA,NA,NA,NA,2020-11-30,53.75
"Gehen",100,129,1536000,1536000,2179,"11/30/20 19:11:41","11/30/20 18:44:04","11/30/20 18:44:04",1536000,0,"TRUE",NA,NA,NA,NA,2020-11-30,25.6
"Gehen",103,130,1536000,1536000,2160,"12/01/20 07:40:28","12/01/20 07:11:14","12/01/20 07:11:14",1536000,0,"TRUE",NA,NA,NA,NA,2020-12-01,25.6
"Gehen",102,248,2713000,2713000,4273,"12/01/20 15:29:07","12/01/20 14:29:00","12/01/20 14:29:00",2713000,0,"TRUE",NA,NA,NA,NA,2020-12-01,45.22
"Gehen",103,146,1741000,1741000,2387,"12/01/20 19:31:04","12/01/20 18:46:42","12/01/20 18:46:42",1741000,0,"TRUE",NA,NA,NA,NA,2020-12-01,29.02
"Gehen",105,134,1485000,1485000,2170,"12/02/20 07:55:57","12/02/20 07:21:33","12/02/20 07:21:33",1485000,0,"TRUE",NA,NA,NA,NA,2020-12-02,24.75
"Training",123,441,4470000,4340000,5236,"12/02/20 10:42:19","12/02/20 09:18:20","12/02/20 09:18:20",4470000,5.486,"TRUE",NA,NA,NA,NA,2020-12-02,74.5
"Gehen",103,227,2560000,2560000,3901,"12/02/20 15:00:09","12/02/20 14:14:07","12/02/20 14:14:07",2560000,0,"TRUE",NA,NA,NA,NA,2020-12-02,42.67
"Gehen",104,147,1638000,1638000,2478,"12/02/20 19:16:33","12/02/20 18:45:29","12/02/20 18:45:29",1638000,3.048,"TRUE",NA,NA,NA,NA,2020-12-02,27.3
"Gehen",111,137,1485000,1485000,2185,"12/03/20 09:04:36","12/03/20 07:18:14","12/03/20 07:18:14",1485000,0,"TRUE",NA,NA,NA,NA,2020-12-03,24.75
"Gehen",103,219,2355000,2355000,3809,"12/03/20 19:22:27","12/03/20 14:21:30","12/03/20 14:21:30",2355000,0,"TRUE",NA,NA,NA,NA,2020-12-03,39.25
"Gehen",102,149,1690000,1690000,2515,"12/03/20 19:22:27","12/03/20 18:41:46","12/03/20 18:41:46",1690000,0,"TRUE",NA,NA,NA,NA,2020-12-03,28.17
"Gehen",110,114,1178000,1178000,1824,"12/04/20 08:05:39","12/04/20 07:30:37","12/04/20 07:30:37",1178000,3.048,"TRUE",NA,NA,NA,NA,2020-12-04,19.63
"Gehen",103,224,2458000,2458000,3868,"12/04/20 14:59:02","12/04/20 14:14:15","12/04/20 14:14:15",2458000,30.48,"TRUE",NA,NA,NA,NA,2020-12-04,40.97
"Training",131,494,4184000,3960000,6585,"12/04/20 17:50:56","12/04/20 15:57:11","12/04/20 15:57:11",4184000,9.449,"TRUE",NA,NA,NA,NA,2020-12-04,69.73
"Gehen",111,140,1433000,1433000,2277,"12/04/20 19:14:27","12/04/20 18:43:55","12/04/20 18:43:55",1433000,0,"TRUE",NA,NA,NA,NA,2020-12-04,23.88
"Gehen",107,149,1587000,1587000,2428,"12/05/20 09:58:48","12/05/20 07:32:47","12/05/20 07:32:47",1587000,18.288,"TRUE",NA,NA,NA,NA,2020-12-05,26.45
"Gehen",99,234,2560000,2560000,4042,"12/05/20 15:03:46","12/05/20 14:07:41","12/05/20 14:07:41",2560000,3.048,"TRUE",NA,NA,NA,NA,2020-12-05,42.67
"Gehen",98,182,2150000,2150000,3026,"12/05/20 19:20:04","12/05/20 18:37:21","12/05/20 18:37:21",2150000,0,"TRUE",NA,NA,NA,NA,2020-12-05,35.83
"Laufen",145,502,3235000,3176000,8197,"12/06/20 11:55:06","12/06/20 10:01:19","12/06/20 10:01:19",3235000,4.877,"TRUE",6.245617,"Kilometer",7.07618765743073,508.748520288269,2020-12-06,53.92
"Gehen",106,278,3021000,3021000,4738,"12/06/20 15:13:01","12/06/20 14:16:39","12/06/20 14:16:39",3021000,0,"TRUE",NA,NA,NA,NA,2020-12-06,50.35
"Gehen",102,138,1587000,1587000,2258,"12/06/20 19:17:04","12/06/20 18:35:13","12/06/20 18:35:13",1587000,6.096,"TRUE",NA,NA,NA,NA,2020-12-06,26.45
"Gehen",106,143,1740000,1740000,2121,"12/07/20 13:06:59","12/07/20 07:18:40","12/07/20 07:18:40",1740000,0,"TRUE",NA,NA,NA,NA,2020-12-07,29
"Gehen",104,233,2560000,2560000,4035,"12/07/20 17:48:25","12/07/20 14:06:33","12/07/20 14:06:33",2560000,6.096,"TRUE",NA,NA,NA,NA,2020-12-07,42.67
"Training",117,218,2957000,2516000,2008,"12/07/20 18:03:30","12/07/20 15:37:07","12/07/20 15:37:07",2957000,2.743,"TRUE",NA,NA,NA,NA,2020-12-07,49.28
"Gehen",104,144,1690000,1690000,2439,"12/07/20 19:19:18","12/07/20 18:41:19","12/07/20 18:41:19",1690000,3.048,"TRUE",NA,NA,NA,NA,2020-12-07,28.17
"Gehen",111,146,1536000,1536000,2472,"12/08/20 07:57:29","12/08/20 07:18:14","12/08/20 07:18:14",1536000,0,"TRUE",NA,NA,NA,NA,2020-12-08,25.6
"Gehen",109,121,1331000,1331000,1832,"12/08/20 09:28:12","12/08/20 08:53:49","12/08/20 08:53:49",1331000,12.192,"TRUE",NA,NA,NA,NA,2020-12-08,22.18
"Gehen",102,240,2663000,2663000,4246,"12/08/20 14:38:51","12/08/20 13:51:37","12/08/20 13:51:37",2663000,0,"TRUE",NA,NA,NA,NA,2020-12-08,44.38
"Training",129,431,3831000,3829000,4560,"12/08/20 17:52:23","12/08/20 15:47:13","12/08/20 15:47:13",3831000,6.706,"TRUE",NA,NA,NA,NA,2020-12-08,63.85
"Gehen",101,176,2099000,2099000,2935,"12/08/20 19:13:25","12/08/20 18:34:55","12/08/20 18:34:55",2099000,0,"TRUE",NA,NA,NA,NA,2020-12-08,34.98
"Gehen",105,122,1331000,1331000,2053,"12/09/20 07:39:58","12/09/20 07:10:07","12/09/20 07:10:07",1331000,0,"TRUE",NA,NA,NA,NA,2020-12-09,22.18
"Gehen",95,244,3020000,3020000,4107,"12/09/20 15:18:51","12/09/20 14:12:31","12/09/20 14:12:31",3020000,0,"TRUE",NA,NA,NA,NA,2020-12-09,50.33
"Gehen",98,148,1843000,1843000,2498,"12/09/20 19:18:29","12/09/20 18:31:04","12/09/20 18:31:04",1843000,3.048,"TRUE",NA,NA,NA,NA,2020-12-09,30.72
"Gehen",100,224,2458000,2458000,3858,"12/10/20 14:56:48","12/10/20 14:12:06","12/10/20 14:12:06",2458000,3.048,"TRUE",NA,NA,NA,NA,2020-12-10,40.97
"Gehen",98,153,1946000,1946000,2527,"12/10/20 19:24:05","12/10/20 18:39:11","12/10/20 18:39:11",1946000,0,"TRUE",NA,NA,NA,NA,2020-12-10,32.43
"Gehen",109,171,1946000,1946000,2573,"12/11/20 11:48:36","12/11/20 07:00:44","12/11/20 07:00:44",1946000,0,"TRUE",NA,NA,NA,NA,2020-12-11,32.43
"Gehen",105,261,3072000,3072000,4225,"12/11/20 15:18:05","12/11/20 14:20:20","12/11/20 14:20:20",3072000,15.24,"TRUE",NA,NA,NA,NA,2020-12-11,51.2
"Laufen",85,0,10000,7000,0,"12/11/20 17:51:03","12/11/20 16:13:36","12/11/20 16:13:36",10000,0,"TRUE",0,"Kilometer",0,NA,2020-12-11,0.17
"Training",95,0,4000,1000,0,"12/11/20 17:51:03","12/11/20 16:14:07","12/11/20 16:14:07",4000,0,"TRUE",NA,NA,NA,NA,2020-12-11,0.07
"Laufband",132,439,3541000,3537000,5248,"12/11/20 17:51:03","12/11/20 16:14:26","12/11/20 16:14:26",3541000,12.802,"TRUE",3.726062,"Kilometer",3.79256997455471,NA,2020-12-11,59.02
"Gehen",106,155,1792000,1792000,2518,"12/11/20 19:12:42","12/11/20 18:32:04","12/11/20 18:32:04",1792000,3.048,"TRUE",NA,NA,NA,NA,2020-12-11,29.87
"Gehen",105,124,1434000,1434000,2059,"12/12/20 13:09:25","12/12/20 07:21:47","12/12/20 07:21:47",1434000,0,"TRUE",NA,NA,NA,NA,2020-12-12,23.9
"Gehen",102,230,2560000,2560000,4095,"12/12/20 15:10:25","12/12/20 14:13:57","12/12/20 14:13:57",2560000,3.048,"TRUE",NA,NA,NA,NA,2020-12-12,42.67
"Gehen",100,161,1894000,1894000,2780,"12/12/20 20:39:29","12/12/20 18:34:13","12/12/20 18:34:13",1894000,0,"TRUE",NA,NA,NA,NA,2020-12-12,31.57
"Gehen",105,131,1484000,1484000,2247,"12/13/20 08:02:05","12/13/20 07:29:03","12/13/20 07:29:03",1484000,0,"TRUE",NA,NA,NA,NA,2020-12-13,24.73
"Laufen",148,594,3747000,3617000,9465,"12/13/20 10:27:03","12/13/20 08:10:51","12/13/20 08:10:51",3747000,3.353,"TRUE",7.304515,"Kilometer",7.27121371302184,495.10303810117,2020-12-13,62.45
"Gehen",100,321,3635000,3635000,5639,"12/13/20 15:24:45","12/13/20 14:16:06","12/13/20 14:16:06",3635000,3.048,"TRUE",NA,NA,NA,NA,2020-12-13,60.58
"Gehen",100,149,1844000,1844000,2431,"12/13/20 19:11:06","12/13/20 18:32:05","12/13/20 18:32:05",1844000,0,"TRUE",NA,NA,NA,NA,2020-12-13,30.73
"Gehen",105,119,1332000,1332000,1966,"12/14/20 07:49:18","12/14/20 07:08:08","12/14/20 07:08:08",1332000,0,"TRUE",NA,NA,NA,NA,2020-12-14,22.2
"Gehen",84,174,3225000,3225000,2260,"12/14/20 10:05:25","12/14/20 08:55:40","12/14/20 08:55:40",3225000,3.048,"TRUE",NA,NA,NA,NA,2020-12-14,53.75
"Gehen",85,82,1382000,1382000,1187,"12/14/20 10:50:44","12/14/20 10:06:29","12/14/20 10:06:29",1382000,3.048,"TRUE",NA,NA,NA,NA,2020-12-14,23.03
"Gehen",89,97,1536000,1536000,1343,"12/14/20 12:06:20","12/14/20 11:28:24","12/14/20 11:28:24",1536000,0,"TRUE",NA,NA,NA,NA,2020-12-14,25.6
"Gehen",101,165,1895000,1895000,2823,"12/14/20 19:15:43","12/14/20 18:39:20","12/14/20 18:39:20",1895000,0,"TRUE",NA,NA,NA,NA,2020-12-14,31.58
"Gehen",112,162,1741000,1741000,2486,"12/15/20 08:00:11","12/15/20 07:11:59","12/15/20 07:11:59",1741000,3.048,"TRUE",NA,NA,NA,NA,2020-12-15,29.02
"Gehen",101,231,2611000,2611000,4127,"12/15/20 20:45:49","12/15/20 14:14:24","12/15/20 14:14:24",2611000,0,"TRUE",NA,NA,NA,NA,2020-12-15,43.52
"Gehen",101,134,1536000,1536000,2287,"12/15/20 20:45:49","12/15/20 18:43:12","12/15/20 18:43:12",1536000,2.438,"TRUE",NA,NA,NA,NA,2020-12-15,25.6
"Gehen",97,126,1485000,1485000,2169,"12/16/20 10:24:23","12/16/20 07:38:16","12/16/20 07:38:16",1485000,0,"TRUE",NA,NA,NA,NA,2020-12-16,24.75
"Laufen",148,559,3730000,3444000,9121,"12/16/20 12:19:15","12/16/20 10:24:51","12/16/20 10:24:51",3730000,4.267,"TRUE",7.252921,"Kilometer",7.5836968641115,474.702518376804,2020-12-16,62.17
"Gehen",103,240,2714000,2714000,4123,"12/16/20 15:26:51","12/16/20 14:32:59","12/16/20 14:32:59",2714000,3.048,"TRUE",NA,NA,NA,NA,2020-12-16,45.23
"Gehen",102,190,2202000,2202000,3162,"12/16/20 19:26:38","12/16/20 18:38:45","12/16/20 18:38:45",2202000,0,"TRUE",NA,NA,NA,NA,2020-12-16,36.7
"Gehen",102,146,1690000,1690000,2479,"12/17/20 08:03:32","12/17/20 07:21:38","12/17/20 07:21:38",1690000,0,"TRUE",NA,NA,NA,NA,2020-12-17,28.17
"Gehen",107,108,1229000,1229000,1783,"12/17/20 09:19:09","12/17/20 08:43:33","12/17/20 08:43:33",1229000,0,"TRUE",NA,NA,NA,NA,2020-12-17,20.48
"Gehen",100,228,2560000,2560000,4054,"12/17/20 15:00:12","12/17/20 14:08:40","12/17/20 14:08:40",2560000,0,"TRUE",NA,NA,NA,NA,2020-12-17,42.67
"Gehen",100,149,1690000,1690000,2529,"12/17/20 19:17:23","12/17/20 18:40:53","12/17/20 18:40:53",1690000,0,"TRUE",NA,NA,NA,NA,2020-12-17,28.17
"Gehen",107,147,1638000,1638000,2314,"12/18/20 07:51:08","12/18/20 07:17:49","12/18/20 07:17:49",1638000,0,"TRUE",NA,NA,NA,NA,2020-12-18,27.3
"Gehen",101,77,972000,972000,1226,"12/18/20 14:11:40","12/18/20 13:46:05","12/18/20 13:46:05",972000,0,"TRUE",NA,NA,NA,NA,2020-12-18,16.2
"Laufen",146,491,3145000,3134000,8289,"12/18/20 17:48:27","12/18/20 15:56:14","12/18/20 15:56:14",3145000,3.048,"TRUE",6.636203,"Kilometer",7.62526866624123,472.114512625372,2020-12-18,52.42
"Gehen",106,166,1843000,1843000,2728,"12/18/20 19:15:39","12/18/20 18:38:46","12/18/20 18:38:46",1843000,3.048,"TRUE",NA,NA,NA,NA,2020-12-18,30.72
"Gehen",104,123,1434000,1434000,2080,"12/19/20 07:45:10","12/19/20 07:19:05","12/19/20 07:19:05",1434000,0,"TRUE",NA,NA,NA,NA,2020-12-19,23.9
"Gehen",101,219,2356000,2356000,3936,"12/19/20 14:40:19","12/19/20 13:55:53","12/19/20 13:55:53",2356000,0,"TRUE",NA,NA,NA,NA,2020-12-19,39.27
"Gehen",97,132,1639000,1639000,2218,"12/19/20 19:23:09","12/19/20 18:41:45","12/19/20 18:41:45",1639000,0,"TRUE",NA,NA,NA,NA,2020-12-19,27.32
"Gehen",102,145,1638000,1638000,2528,"12/20/20 08:23:49","12/20/20 07:46:50","12/20/20 07:46:50",1638000,0,"TRUE",NA,NA,NA,NA,2020-12-20,27.3
"Gehen",98,259,2918000,2918000,4549,"12/20/20 15:04:29","12/20/20 14:00:36","12/20/20 14:00:36",2918000,3.048,"TRUE",NA,NA,NA,NA,2020-12-20,48.63
"Gehen",97,141,1793000,1793000,2322,"12/20/20 19:19:36","12/20/20 18:42:11","12/20/20 18:42:11",1793000,3.048,"TRUE",NA,NA,NA,NA,2020-12-20,29.88
"Laufen",146,471,2961000,2956000,7821,"12/21/20 11:37:15","12/21/20 10:16:35","12/21/20 10:16:35",2961000,2.743,"TRUE",6.451523,"Kilometer",7.85706089309878,458.18659788701,2020-12-21,49.35
"Gehen",101,221,2561000,2561000,3786,"12/21/20 15:17:26","12/21/20 14:18:06","12/21/20 14:18:06",2561000,2.387,"TRUE",NA,NA,NA,NA,2020-12-21,42.68
"Gehen",99,159,1843000,1843000,2740,"12/21/20 19:19:42","12/21/20 18:41:47","12/21/20 18:41:47",1843000,0,"TRUE",NA,NA,NA,NA,2020-12-21,30.72
"Gehen",101,127,1536000,1536000,2108,"12/22/20 07:41:34","12/22/20 07:10:10","12/22/20 07:10:10",1536000,0,"TRUE",NA,NA,NA,NA,2020-12-22,25.6
"Gehen",104,210,2253000,2253000,3822,"12/22/20 21:22:07","12/22/20 13:34:10","12/22/20 13:34:10",2253000,0,"TRUE",NA,NA,NA,NA,2020-12-22,37.55
"Gehen",97,149,1792000,1792000,2566,"12/22/20 21:22:07","12/22/20 18:39:40","12/22/20 18:39:40",1792000,0,"TRUE",NA,NA,NA,NA,2020-12-22,29.87
"Laufen",151,387,2595000,2361000,6221,"12/23/20 05:30:30","12/23/20 04:03:13","12/23/20 04:03:13",2595000,4.267,"TRUE",5.258835,"Kilometer",8.02095552731893,448.824331183311,2020-12-23,43.25
"Gehen",94,77,1075000,1075000,1194,"12/23/20 08:46:19","12/23/20 08:15:28","12/23/20 08:15:28",1075000,0,"TRUE",NA,NA,NA,NA,2020-12-23,17.92
"Gehen",98,240,2714000,2714000,4138,"12/23/20 14:56:55","12/23/20 14:07:53","12/23/20 14:07:53",2714000,0,"TRUE",NA,NA,NA,NA,2020-12-23,45.23
"Gehen",100,166,1997000,1997000,2780,"12/23/20 19:26:10","12/23/20 18:39:15","12/23/20 18:39:15",1997000,0,"TRUE",NA,NA,NA,NA,2020-12-23,33.28
"Gehen",96,128,1587000,1587000,2179,"12/24/20 08:00:24","12/24/20 07:21:18","12/24/20 07:21:18",1587000,2.286,"TRUE",NA,NA,NA,NA,2020-12-24,26.45
"Gehen",102,217,2406000,2406000,3820,"12/24/20 14:27:00","12/24/20 13:38:29","12/24/20 13:38:29",2406000,3.048,"TRUE",NA,NA,NA,NA,2020-12-24,40.1
"Gehen",105,118,1229000,1229000,2123,"12/24/20 20:00:21","12/24/20 19:26:38","12/24/20 19:26:38",1229000,0,"TRUE",NA,NA,NA,NA,2020-12-24,20.48
"Gehen",103,131,1536000,1536000,2173,"12/25/20 08:03:58","12/25/20 07:29:26","12/25/20 07:29:26",1536000,0,"TRUE",NA,NA,NA,NA,2020-12-25,25.6
"Laufen",151,707,4587000,4277000,11564,"12/25/20 11:19:46","12/25/20 08:18:38","12/25/20 08:18:38",4587000,12.497,"TRUE",9.378937,"Kilometer",7.89816600420856,455.802017592658,2020-12-25,76.45
"Gehen",106,215,2355000,2355000,3786,"12/25/20 14:51:35","12/25/20 13:56:00","12/25/20 13:56:00",2355000,0,"TRUE",NA,NA,NA,NA,2020-12-25,39.25
"Gehen",104,150,1587000,1587000,2631,"12/25/20 19:20:47","12/25/20 18:41:52","12/25/20 18:41:52",1587000,6.096,"TRUE",NA,NA,NA,NA,2020-12-25,26.45
"Gehen",100,120,1382000,1382000,2054,"12/26/20 08:32:32","12/26/20 07:51:13","12/26/20 07:51:13",1382000,3.048,"TRUE",NA,NA,NA,NA,2020-12-26,23.03
"Gehen",99,237,2612000,2612000,4206,"12/26/20 14:58:34","12/26/20 14:10:56","12/26/20 14:10:56",2612000,0,"TRUE",NA,NA,NA,NA,2020-12-26,43.53
"Aerobic",109,111,1434000,1434000,1323,"12/26/20 16:32:53","12/26/20 16:05:17","12/26/20 16:05:17",1434000,NA,"TRUE",NA,NA,NA,NA,2020-12-26,23.9
"Gehen",101,132,1536000,1536000,2236,"12/26/20 21:34:09","12/26/20 18:38:53","12/26/20 18:38:53",1536000,0,"TRUE",NA,NA,NA,NA,2020-12-26,25.6
"Gehen",106,130,1484000,1484000,2156,"12/27/20 08:03:07","12/27/20 07:31:10","12/27/20 07:31:10",1484000,0,"TRUE",NA,NA,NA,NA,2020-12-27,24.73
"Training",139,969,7319000,7313000,9496,"12/27/20 12:20:59","12/27/20 08:18:07","12/27/20 08:18:07",7319000,30.48,"TRUE",NA,NA,NA,NA,2020-12-27,121.98
"Gehen",105,228,2560000,2560000,3958,"12/27/20 15:20:43","12/27/20 14:23:19","12/27/20 14:23:19",2560000,3.048,"TRUE",NA,NA,NA,NA,2020-12-27,42.67
"Gehen",101,131,1587000,1587000,2161,"12/27/20 19:07:39","12/27/20 18:34:12","12/27/20 18:34:12",1587000,0,"TRUE",NA,NA,NA,NA,2020-12-27,26.45
"Gehen",107,134,1536000,1536000,2185,"12/28/20 08:13:51","12/28/20 07:35:00","12/28/20 07:35:00",1536000,3.048,"TRUE",NA,NA,NA,NA,2020-12-28,25.6
"Laufen",148,517,3920000,3276000,8809,"12/28/20 11:00:37","12/28/20 09:23:12","12/28/20 09:23:12",3920000,15.545,"TRUE",7.219562,"Kilometer",7.9382967032967,453.497788575344,2020-12-28,65.33
"Gehen",106,302,3277000,3277000,5299,"12/28/20 15:17:54","12/28/20 14:19:29","12/28/20 14:19:29",3277000,9.144,"TRUE",NA,NA,NA,NA,2020-12-28,54.62
"Gehen",100,175,2150000,2150000,2949,"12/28/20 19:19:46","12/28/20 18:40:36","12/28/20 18:40:36",2150000,0,"TRUE",NA,NA,NA,NA,2020-12-28,35.83
"Gehen",105,129,1485000,1485000,2074,"12/29/20 08:02:45","12/29/20 07:29:27","12/29/20 07:29:27",1485000,0,"TRUE",NA,NA,NA,NA,2020-12-29,24.75
"Laufen",147,453,3134000,2896000,7795,"12/29/20 09:35:47","12/29/20 08:31:00","12/29/20 08:31:00",3134000,5.791,"TRUE",6.14882,"Kilometer",7.64843370165746,470.684605557849,2020-12-29,52.23
"Gehen",101,213,2457000,2457000,3765,"12/29/20 17:05:50","12/29/20 14:07:59","12/29/20 14:07:59",2457000,3.048,"TRUE",NA,NA,NA,NA,2020-12-29,40.95
"Gehen",102,165,1894000,1894000,2822,"12/29/20 19:21:36","12/29/20 18:35:56","12/29/20 18:35:56",1894000,0,"TRUE",NA,NA,NA,NA,2020-12-29,31.57
"Gehen",101,162,1894000,1894000,2669,"12/30/20 08:09:28","12/30/20 07:24:47","12/30/20 07:24:47",1894000,0,"TRUE",NA,NA,NA,NA,2020-12-30,31.57
"Gehen",96,197,2407000,2407000,3432,"12/30/20 15:11:36","12/30/20 14:21:12","12/30/20 14:21:12",2407000,0,"TRUE",NA,NA,NA,NA,2020-12-30,40.12
"Gehen",98,151,1844000,1844000,2556,"12/30/20 19:28:53","12/30/20 18:40:44","12/30/20 18:40:44",1844000,0,"TRUE",NA,NA,NA,NA,2020-12-30,30.73
"Gehen",102,126,1485000,1485000,2190,"12/31/20 08:00:45","12/31/20 07:26:11","12/31/20 07:26:11",1485000,0,"TRUE",NA,NA,NA,NA,2020-12-31,24.75
"Laufen",146,596,3984000,3768000,10230,"12/31/20 13:01:51","12/31/20 09:27:27","12/31/20 09:27:27",3984000,6.096,"TRUE",8.30039,"Kilometer",7.93349044585987,453.772526048566,2020-12-31,66.4
"Gehen",NA,160,3041000,3041000,5131,"12/31/20 15:13:45","12/31/20 14:17:29","12/31/20 14:17:29",3041000,NA,"TRUE",3.608651,"Kilometer",4.27199723775074,842.697174096359,2020-12-31,50.68
"Gehen",100,112,1280000,1280000,1940,"12/31/20 22:26:30","12/31/20 18:59:06","12/31/20 18:59:06",1280000,0,"TRUE",NA,NA,NA,NA,2020-12-31,21.33
"Aerobic",104,219,3225000,3225000,2575,"12/31/20 22:42:24","12/31/20 21:43:48","12/31/20 21:43:48",3225000,NA,"TRUE",NA,NA,NA,NA,2020-12-31,53.75
"Gehen",101,130,1639000,1639000,2113,"01/01/21 08:45:26","01/01/21 08:04:10","01/01/21 08:04:10",1639000,0,"TRUE",NA,NA,NA,NA,2021-01-01,27.32
"Gehen",100,230,2662000,2662000,4107,"01/01/21 15:02:17","01/01/21 14:12:49","01/01/21 14:12:49",2662000,0,"TRUE",NA,NA,NA,NA,2021-01-01,44.37
"Gehen",93,153,1894000,1894000,2570,"01/01/21 19:21:03","01/01/21 18:33:56","01/01/21 18:33:56",1894000,0,"TRUE",NA,NA,NA,NA,2021-01-01,31.57
"Gehen",97,139,1587000,1587000,2385,"01/02/21 08:12:08","01/02/21 07:33:53","01/02/21 07:33:53",1587000,0,"TRUE",NA,NA,NA,NA,2021-01-02,26.45
"Laufen",139,394,3196000,2702000,7137,"01/02/21 09:47:26","01/02/21 08:32:49","01/02/21 08:32:49",3196000,5.486,"TRUE",5.407132,"Kilometer",7.20434344929682,499.698553426319,2021-01-02,53.27
"Gehen",97,276,3123000,3123000,4883,"01/02/21 14:59:50","01/02/21 14:02:09","01/02/21 14:02:09",3123000,0,"TRUE",NA,NA,NA,NA,2021-01-02,52.05
"Gehen",99,172,1996000,1996000,2958,"01/02/21 19:16:55","01/02/21 18:28:24","01/02/21 18:28:24",1996000,0,"TRUE",NA,NA,NA,NA,2021-01-02,33.27
"Gehen",95,226,2509000,2509000,3995,"01/03/21 14:56:07","01/03/21 14:09:25","01/03/21 14:09:25",2509000,0,"TRUE",NA,NA,NA,NA,2021-01-03,41.82
"Training",123,328,3282000,3260000,2915,"01/03/21 17:23:53","01/03/21 15:58:26","01/03/21 15:58:26",3282000,4.267,"TRUE",NA,NA,NA,NA,2021-01-03,54.7
"Gehen",98,154,1843000,1843000,2571,"01/03/21 19:28:23","01/03/21 18:41:38","01/03/21 18:41:38",1843000,0,"TRUE",NA,NA,NA,NA,2021-01-03,30.72
"Gehen",104,127,1484000,1484000,1998,"01/04/21 08:04:09","01/04/21 07:30:30","01/04/21 07:30:30",1484000,0,"TRUE",NA,NA,NA,NA,2021-01-04,24.73
"Laufen",145,516,3531000,3383000,9067,"01/04/21 11:52:13","01/04/21 08:51:43","01/04/21 08:51:43",3531000,3.962,"TRUE",7.267664,"Kilometer",7.73066745492167,465.677772455222,2021-01-04,58.85
"Training",115,85,1135000,1132000,376,"01/04/21 11:52:12","01/04/21 09:53:22","01/04/21 09:53:22",1135000,2.743,"TRUE",NA,NA,NA,NA,2021-01-04,18.92
"Gehen",103,226,2457000,2457000,3935,"01/04/21 15:08:47","01/04/21 14:14:08","01/04/21 14:14:08",2457000,0,"TRUE",NA,NA,NA,NA,2021-01-04,40.95
"Gehen",99,148,1741000,1741000,2528,"01/04/21 19:24:05","01/04/21 18:39:31","01/04/21 18:39:31",1741000,0,"TRUE",NA,NA,NA,NA,2021-01-04,29.02
"Gehen",101,133,1536000,1536000,2187,"01/05/21 07:46:00","01/05/21 07:09:38","01/05/21 07:09:38",1536000,0,"TRUE",NA,NA,NA,NA,2021-01-05,25.6
"Gehen",95,241,2816000,2816000,4227,"01/05/21 14:50:02","01/05/21 13:49:00","01/05/21 13:49:00",2816000,0,"TRUE",NA,NA,NA,NA,2021-01-05,46.93
"Gehen",98,154,1843000,1843000,2615,"01/05/21 19:28:56","01/05/21 18:41:42","01/05/21 18:41:42",1843000,0,"TRUE",NA,NA,NA,NA,2021-01-05,30.72
"Gehen",102,130,1433000,1433000,2244,"01/06/21 08:33:52","01/06/21 07:39:57","01/06/21 07:39:57",1433000,0,"TRUE",NA,NA,NA,NA,2021-01-06,23.88
"Laufen",142,552,4019000,3609000,9587,"01/06/21 10:35:42","01/06/21 08:36:06","01/06/21 08:36:06",4019000,1.524,"TRUE",7.353851,"Kilometer",7.33981047381546,490.475879839525,2021-01-06,66.98
"Gehen",98,221,2510000,2510000,3891,"01/06/21 20:53:05","01/06/21 13:54:33","01/06/21 13:54:33",2510000,0,"TRUE",NA,NA,NA,NA,2021-01-06,41.83
"Gehen",101,164,1945000,1945000,2787,"01/06/21 20:53:05","01/06/21 18:31:03","01/06/21 18:31:03",1945000,0,"TRUE",NA,NA,NA,NA,2021-01-06,32.42
"Gehen",95,125,1536000,1536000,2127,"01/07/21 07:48:47","01/07/21 07:07:06","01/07/21 07:07:06",1536000,0,"TRUE",NA,NA,NA,NA,2021-01-07,25.6
"Laufen",141,378,2891000,2500000,6540,"01/07/21 09:04:43","01/07/21 08:01:10","01/07/21 08:01:10",2891000,1.219,"TRUE",5.214789,"Kilometer",7.5107808,479.311019168606,2021-01-07,48.18
"Gehen",97,289,3277000,3277000,5124,"01/07/21 15:01:27","01/07/21 14:00:07","01/07/21 14:00:07",3277000,0,"TRUE",NA,NA,NA,NA,2021-01-07,54.62
"Gehen",99,161,1894000,1894000,2737,"01/07/21 19:18:06","01/07/21 18:40:01","01/07/21 18:40:01",1894000,0,"TRUE",NA,NA,NA,NA,2021-01-07,31.57
"Gehen",103,167,1946000,1946000,2783,"01/08/21 08:07:23","01/08/21 07:19:29","01/08/21 07:19:29",1946000,0,"TRUE",NA,NA,NA,NA,2021-01-08,32.43
"Gehen",98,228,2611000,2611000,3975,"01/08/21 15:03:53","01/08/21 14:16:46","01/08/21 14:16:46",2611000,0,"TRUE",NA,NA,NA,NA,2021-01-08,43.52
"Gehen",96,148,1843000,1843000,2442,"01/08/21 21:52:43","01/08/21 18:35:20","01/08/21 18:35:20",1843000,0,"TRUE",NA,NA,NA,NA,2021-01-08,30.72
"Gehen",96,155,1843000,1843000,2652,"01/09/21 08:03:56","01/09/21 07:21:38","01/09/21 07:21:38",1843000,0,"TRUE",NA,NA,NA,NA,2021-01-09,30.72
"Laufen",150,543,3376000,3240000,8723,"01/09/21 13:45:15","01/09/21 12:15:25","01/09/21 12:15:25",3376000,6.401,"TRUE",7.152484,"Kilometer",7.95215555555555,452.707442007338,2021-01-09,56.27
"Gehen",108,241,2509000,2509000,4063,"01/09/21 15:07:22","01/09/21 14:14:39","01/09/21 14:14:39",2509000,0,"TRUE",NA,NA,NA,NA,2021-01-09,41.82
"Training",114,363,4219000,4214000,3280,"01/09/21 17:35:11","01/09/21 15:47:10","01/09/21 15:47:10",4219000,4.572,"TRUE",NA,NA,NA,NA,2021-01-09,70.32
"Gehen",102,151,1741000,1741000,2519,"01/09/21 19:11:24","01/09/21 18:35:46","01/09/21 18:35:46",1741000,0,"TRUE",NA,NA,NA,NA,2021-01-09,29.02
"Gehen",100,144,1741000,1741000,2349,"01/10/21 08:09:34","01/10/21 07:34:01","01/10/21 07:34:01",1741000,3.048,"TRUE",NA,NA,NA,NA,2021-01-10,29.02
"Gehen",97,221,2458000,2458000,3950,"01/10/21 14:58:01","01/10/21 14:11:41","01/10/21 14:11:41",2458000,0,"TRUE",NA,NA,NA,NA,2021-01-10,40.97
"Training",123,426,3834000,3831000,5897,"01/10/21 17:21:21","01/10/21 15:30:28","01/10/21 15:30:28",3834000,5.791,"TRUE",NA,NA,NA,NA,2021-01-10,63.9
"Gehen",102,144,1638000,1638000,2444,"01/10/21 19:07:20","01/10/21 18:32:48","01/10/21 18:32:48",1638000,0,"TRUE",NA,NA,NA,NA,2021-01-10,27.3
"Gehen",102,130,1485000,1485000,2120,"01/11/21 07:55:44","01/11/21 07:23:22","01/11/21 07:23:22",1485000,0,"TRUE",NA,NA,NA,NA,2021-01-11,24.75
"Laufen",146,599,3911000,3774000,10063,"01/11/21 11:50:51","01/11/21 09:48:19","01/11/21 09:48:19",3911000,7.62,"TRUE",8.39639,"Kilometer",8.01418759936407,449.203360336319,2021-01-11,65.18
"Gehen",99,233,2765000,2765000,3926,"01/11/21 15:22:41","01/11/21 14:32:36","01/11/21 14:32:36",2765000,0,"TRUE",NA,NA,NA,NA,2021-01-11,46.08
"Gehen",98,135,1639000,1639000,2233,"01/11/21 19:18:07","01/11/21 18:34:57","01/11/21 18:34:57",1639000,0,"TRUE",NA,NA,NA,NA,2021-01-11,27.32
"Gehen",100,123,1383000,1383000,2115,"01/12/21 07:54:11","01/12/21 07:25:31","01/12/21 07:25:31",1383000,0,"TRUE",NA,NA,NA,NA,2021-01-12,23.05
"Gehen",94,246,2969000,2969000,4098,"01/12/21 15:34:35","01/12/21 14:11:43","01/12/21 14:11:43",2969000,0,"TRUE",NA,NA,NA,NA,2021-01-12,49.48
"Gehen",100,164,1895000,1895000,2883,"01/12/21 19:15:49","01/12/21 18:35:23","01/12/21 18:35:23",1895000,6.096,"TRUE",NA,NA,NA,NA,2021-01-12,31.58
"Gehen",102,122,1331000,1331000,2077,"01/13/21 09:37:21","01/13/21 07:13:09","01/13/21 07:13:09",1331000,0,"TRUE",NA,NA,NA,NA,2021-01-13,22.18
"Training",127,655,5652000,5448000,8923,"01/13/21 11:54:02","01/13/21 08:01:45","01/13/21 08:01:45",5652000,8.839,"TRUE",NA,NA,NA,NA,2021-01-13,94.2
"Gehen",99,208,2304000,2304000,3702,"01/13/21 14:09:31","01/13/21 13:25:12","01/13/21 13:25:12",2304000,3.048,"TRUE",NA,NA,NA,NA,2021-01-13,38.4
"Gehen",98,129,1536000,1536000,2238,"01/13/21 19:07:32","01/13/21 18:38:22","01/13/21 18:38:22",1536000,0,"TRUE",NA,NA,NA,NA,2021-01-13,25.6
"Gehen",98,126,1433000,1433000,2169,"01/14/21 07:51:37","01/14/21 07:12:42","01/14/21 07:12:42",1433000,0,"TRUE",NA,NA,NA,NA,2021-01-14,23.88
"Gehen",99,188,2048000,2048000,3445,"01/14/21 14:58:33","01/14/21 14:17:40","01/14/21 14:17:40",2048000,8.534,"TRUE",NA,NA,NA,NA,2021-01-14,34.13
"Training",94,164,2740000,2737000,1956,"01/14/21 16:29:20","01/14/21 15:40:30","01/14/21 15:40:30",2740000,4.877,"TRUE",NA,NA,NA,NA,2021-01-14,45.67
"Gehen",92,133,1638000,1638000,2212,"01/14/21 19:19:18","01/14/21 18:38:47","01/14/21 18:38:47",1638000,3.048,"TRUE",NA,NA,NA,NA,2021-01-14,27.3
"Gehen",99,154,1792000,1792000,2580,"01/15/21 09:10:41","01/15/21 07:26:47","01/15/21 07:26:47",1792000,0,"TRUE",NA,NA,NA,NA,2021-01-15,29.87
"Laufen",150,518,3437000,3129000,8535,"01/15/21 09:10:50","01/15/21 08:06:32","01/15/21 08:06:32",3437000,4.267,"TRUE",7.057875,"Kilometer",8.12096260786194,443.297201801524,2021-01-15,57.28
"Gehen",94,216,2508000,2508000,3870,"01/15/21 15:55:47","01/15/21 14:22:22","01/15/21 14:22:22",2508000,0,"TRUE",NA,NA,NA,NA,2021-01-15,41.8
"Gehen",94,130,1639000,1639000,2228,"01/15/21 19:12:26","01/15/21 18:37:31","01/15/21 18:37:31",1639000,0,"TRUE",NA,NA,NA,NA,2021-01-15,27.32
"Gehen",98,207,2253000,2253000,3790,"01/16/21 15:06:24","01/16/21 14:13:26","01/16/21 14:13:26",2253000,0,"TRUE",NA,NA,NA,NA,2021-01-16,37.55
"Gehen",96,145,1689000,1689000,2401,"01/16/21 19:19:41","01/16/21 18:37:58","01/16/21 18:37:58",1689000,3.048,"TRUE",NA,NA,NA,NA,2021-01-16,28.15
"Gehen",95,356,3891000,3891000,6397,"01/17/21 15:24:38","01/17/21 14:10:28","01/17/21 14:10:28",3891000,0,"TRUE",NA,NA,NA,NA,2021-01-17,64.85
"Laufen",149,488,3025000,2899000,7916,"01/17/21 17:32:31","01/17/21 15:33:56","01/17/21 15:33:56",3025000,0.61,"TRUE",6.491046,"Kilometer",8.06063470162125,446.614954437264,2021-01-17,50.42
"Gehen",101,142,1689000,1689000,2372,"01/17/21 19:25:42","01/17/21 18:42:41","01/17/21 18:42:41",1689000,0,"TRUE",NA,NA,NA,NA,2021-01-17,28.15
"Gehen",98,120,1536000,1536000,2062,"01/18/21 08:02:17","01/18/21 07:33:14","01/18/21 07:33:14",1536000,0,"TRUE",NA,NA,NA,NA,2021-01-18,25.6
"Gehen",99,282,3419000,3065000,5120,"01/18/21 15:05:46","01/18/21 14:07:42","01/18/21 14:07:42",3419000,8.534,"TRUE",3.558929,"Kilometer",4.18014616639478,861.213904179065,2021-01-18,56.98
"Training",106,220,3050000,2511000,3294,"01/18/21 17:16:15","01/18/21 16:09:44","01/18/21 16:09:44",3050000,9.754,"TRUE",NA,NA,NA,NA,2021-01-18,50.83
"Gehen",97,163,1996000,1996000,2744,"01/18/21 19:28:33","01/18/21 18:36:17","01/18/21 18:36:17",1996000,0,"TRUE",NA,NA,NA,NA,2021-01-18,33.27
"Gehen",101,131,1484000,1484000,2180,"01/19/21 07:47:13","01/19/21 07:02:58","01/19/21 07:02:58",1484000,0,"TRUE",NA,NA,NA,NA,2021-01-19,24.73
"Laufen",150,593,6833000,3535000,9758,"01/19/21 11:46:31","01/19/21 09:42:38","01/19/21 09:42:38",6833000,6.706,"TRUE",8.143554,"Kilometer",8.29430834512023,434.032573929806,2021-01-19,113.88
"Gehen",101,221,2458000,2458000,3914,"01/19/21 16:32:32","01/19/21 13:55:58","01/19/21 13:55:58",2458000,0,"TRUE",NA,NA,NA,NA,2021-01-19,40.97
"Gehen",98,125,1484000,1484000,2066,"01/19/21 19:21:33","01/19/21 18:39:17","01/19/21 18:39:17",1484000,6.096,"TRUE",NA,NA,NA,NA,2021-01-19,24.73
"Gehen",93,225,2509000,2509000,4048,"01/20/21 14:56:07","01/20/21 13:58:58","01/20/21 13:58:58",2509000,0,"TRUE",NA,NA,NA,NA,2021-01-20,41.82
"Laufen",149,374,2378000,2270000,6107,"01/20/21 15:51:30","01/20/21 15:00:24","01/20/21 15:00:24",2378000,2.438,"TRUE",5.192906,"Kilometer",8.23913127753304,436.939269291254,2021-01-20,39.63
"Gehen",100,152,1741000,1741000,2617,"01/20/21 19:15:45","01/20/21 18:41:25","01/20/21 18:41:25",1741000,0,"TRUE",NA,NA,NA,NA,2021-01-20,29.02
"Gehen",96,170,2048000,2048000,3067,"01/21/21 08:04:05","01/21/21 07:16:38","01/21/21 07:16:38",2048000,0,"TRUE",NA,NA,NA,NA,2021-01-21,34.13
"Gehen",93,260,3072000,3072000,4688,"01/21/21 15:17:23","01/21/21 14:19:02","01/21/21 14:19:02",3072000,0,"TRUE",NA,NA,NA,NA,2021-01-21,51.2
"Laufen",152,220,2211000,1345000,3688,"01/21/21 17:38:54","01/21/21 15:42:17","01/21/21 15:42:17",2211000,0.914,"TRUE",3.162289,"Kilometer",8.4641219330855,425.324685591771,2021-01-21,36.85
"Training",118,104,1285000,1283000,130,"01/21/21 17:38:54","01/21/21 16:27:57","01/21/21 16:27:57",1285000,3.353,"TRUE",NA,NA,NA,NA,2021-01-21,21.42
"Gehen",96,142,1843000,1843000,2329,"01/21/21 19:18:05","01/21/21 18:39:18","01/21/21 18:39:18",1843000,3.048,"TRUE",NA,NA,NA,NA,2021-01-21,30.72
"Gehen",105,130,1434000,1434000,2253,"01/22/21 07:40:04","01/22/21 07:09:23","01/22/21 07:09:23",1434000,0,"TRUE",NA,NA,NA,NA,2021-01-22,23.9
"Gehen",127,555,4327000,4325000,9657,"01/22/21 10:07:21","01/22/21 08:48:03","01/22/21 08:48:03",4327000,4.267,"TRUE",7.738179,"Kilometer",6.44186913294798,558.844013391582,2021-01-22,72.12
"Gehen",94,230,2611000,2611000,4120,"01/22/21 15:09:16","01/22/21 14:10:56","01/22/21 14:10:56",2611000,0,"TRUE",NA,NA,NA,NA,2021-01-22,43.52
"Laufen",152,300,2013000,1802000,4904,"01/22/21 17:01:29","01/22/21 15:09:34","01/22/21 15:09:34",2013000,0.914,"TRUE",4.210812,"Kilometer",8.41720754716981,427.695287282117,2021-01-22,33.55
"Gehen",96,140,1792000,1792000,2409,"01/22/21 19:15:09","01/22/21 18:38:01","01/22/21 18:38:01",1792000,3.048,"TRUE",NA,NA,NA,NA,2021-01-22,29.87
"Gehen",95,169,1997000,1997000,3008,"01/23/21 08:03:46","01/23/21 07:26:02","01/23/21 07:26:02",1997000,3.048,"TRUE",NA,NA,NA,NA,2021-01-23,33.28
"Laufen",146,210,1506000,1370000,3761,"01/23/21 10:37:43","01/23/21 09:56:01","01/23/21 09:56:01",1506000,4.572,"TRUE",3.241421,"Kilometer",8.51460437956204,422.802967644771,2021-01-23,25.1
"Training",114,161,2203000,2200000,545,"01/23/21 11:38:16","01/23/21 10:29:06","01/23/21 10:29:06",2203000,7.62,"TRUE",NA,NA,NA,NA,2021-01-23,36.72
"Gehen",100,207,2304000,2304000,3765,"01/23/21 15:00:41","01/23/21 14:13:04","01/23/21 14:13:04",2304000,3.048,"TRUE",NA,NA,NA,NA,2021-01-23,38.4
"Gehen",92,145,1895000,1895000,2395,"01/23/21 19:15:23","01/23/21 18:37:36","01/23/21 18:37:36",1895000,0,"TRUE",NA,NA,NA,NA,2021-01-23,31.58
"Gehen",95,117,1383000,1383000,2081,"01/24/21 08:45:59","01/24/21 07:42:41","01/24/21 07:42:41",1383000,0,"TRUE",NA,NA,NA,NA,2021-01-24,23.05
"Laufen",148,763,5005000,4731000,12819,"01/24/21 10:45:22","01/24/21 08:47:26","01/24/21 08:47:26",5005000,13.716,"TRUE",10.30739,"Kilometer",7.84685859226379,458.782321316359,2021-01-24,83.42
"Gehen",99,221,2407000,2407000,3985,"01/24/21 14:54:38","01/24/21 13:59:00","01/24/21 13:59:00",2407000,9.144,"TRUE",NA,NA,NA,NA,2021-01-24,40.12
"Gehen",92,152,1945000,1945000,2564,"01/24/21 19:11:46","01/24/21 18:35:29","01/24/21 18:35:29",1945000,3.048,"TRUE",NA,NA,NA,NA,2021-01-24,32.42
"Gehen",100,176,2099000,2099000,2988,"01/25/21 08:19:31","01/25/21 07:26:54","01/25/21 07:26:54",2099000,0,"TRUE",NA,NA,NA,NA,2021-01-25,34.98
"Gehen",99,470,5445000,5284000,8490,"01/25/21 15:16:09","01/25/21 13:42:47","01/25/21 13:42:47",5445000,6.401,"TRUE",6.261289,"Kilometer",4.26624526873581,843.83334131813,2021-01-25,90.75
"Gehen",91,135,1638000,1638000,2255,"01/25/21 19:20:00","01/25/21 18:41:54","01/25/21 18:41:54",1638000,3.048,"TRUE",NA,NA,NA,NA,2021-01-25,27.3
"Gehen",96,120,1331000,1331000,2129,"01/26/21 07:33:04","01/26/21 07:07:00","01/26/21 07:07:00",1331000,0,"TRUE",NA,NA,NA,NA,2021-01-26,22.18
"Gehen",96,214,2406000,2406000,3902,"01/26/21 17:14:57","01/26/21 13:56:36","01/26/21 13:56:36",2406000,0,"TRUE",NA,NA,NA,NA,2021-01-26,40.1
"Training",117,417,5584000,4615000,3801,"01/26/21 17:15:31","01/26/21 14:50:12","01/26/21 14:50:12",5584000,12.802,"TRUE",NA,NA,NA,NA,2021-01-26,93.07
"Gehen",97,133,1638000,1638000,2307,"01/26/21 19:17:49","01/26/21 18:36:30","01/26/21 18:36:30",1638000,3.048,"TRUE",NA,NA,NA,NA,2021-01-26,27.3
"Laufen",150,528,3360000,3233000,8891,"01/27/21 06:08:54","01/27/21 04:54:57","01/27/21 04:54:57",3360000,5.486,"TRUE",7.167437,"Kilometer",7.98211197030622,451.008456582938,2021-01-27,56
"Gehen",107,146,1690000,1690000,2327,"01/27/21 07:54:49","01/27/21 07:19:22","01/27/21 07:19:22",1690000,0,"TRUE",NA,NA,NA,NA,2021-01-27,28.17
"Gehen",92,222,2611000,2611000,3939,"01/27/21 14:41:18","01/27/21 13:45:05","01/27/21 13:45:05",2611000,0,"TRUE",NA,NA,NA,NA,2021-01-27,43.52
"Gehen",93,135,1690000,1690000,2318,"01/27/21 21:25:54","01/27/21 18:40:20","01/27/21 18:40:20",1690000,0,"TRUE",NA,NA,NA,NA,2021-01-27,28.17
"Gehen",96,111,1332000,1332000,2038,"01/28/21 08:07:10","01/28/21 07:27:28","01/28/21 07:27:28",1332000,0,"TRUE",NA,NA,NA,NA,2021-01-28,22.2
"Laufen",147,578,3624000,3616000,9953,"01/28/21 09:47:34","01/28/21 08:19:15","01/28/21 08:19:15",3624000,7.925,"TRUE",8.231312,"Kilometer",8.19312610619469,439.392724259193,2021-01-28,60.4
"Gehen",93,261,3379000,3379000,4428,"01/28/21 19:17:36","01/28/21 14:11:06","01/28/21 14:11:06",3379000,6.096,"TRUE",NA,NA,NA,NA,2021-01-28,56.32
"Gehen",93,87,1177000,1177000,1415,"01/28/21 19:17:36","01/28/21 18:44:11","01/28/21 18:44:11",1177000,0,"TRUE",NA,NA,NA,NA,2021-01-28,19.62
"Gehen",98,122,1433000,1433000,2141,"01/29/21 07:59:24","01/29/21 07:27:56","01/29/21 07:27:56",1433000,0,"TRUE",NA,NA,NA,NA,2021-01-29,23.88
"Laufen",152,426,2609000,2605000,7267,"01/29/21 09:43:47","01/29/21 08:03:26","01/29/21 08:03:26",2609000,3.353,"TRUE",6.100023,"Kilometer",8.42997005758157,427.047780171213,2021-01-29,43.48
"Gehen",97,215,2406000,2406000,3849,"01/29/21 14:43:11","01/29/21 13:57:03","01/29/21 13:57:03",2406000,0,"TRUE",NA,NA,NA,NA,2021-01-29,40.1
"Gehen",92,163,2048000,2048000,2825,"01/29/21 19:30:44","01/29/21 18:39:30","01/29/21 18:39:30",2048000,12.192,"TRUE",NA,NA,NA,NA,2021-01-29,34.13
"Gehen",97,208,2355000,2355000,3815,"01/30/21 14:46:16","01/30/21 13:58:32","01/30/21 13:58:32",2355000,0,"TRUE",NA,NA,NA,NA,2021-01-30,39.25
"Training",121,381,3913000,3912000,4024,"01/30/21 17:02:09","01/30/21 15:39:56","01/30/21 15:39:56",3913000,9.449,"TRUE",NA,NA,NA,NA,2021-01-30,65.22
"Gehen",94,140,1741000,1741000,2360,"01/30/21 21:14:32","01/30/21 18:40:59","01/30/21 18:40:59",1741000,6.096,"TRUE",NA,NA,NA,NA,2021-01-30,29.02
"Gehen",96,117,1382000,1382000,2084,"01/31/21 08:29:57","01/31/21 07:53:44","01/31/21 07:53:44",1382000,3.048,"TRUE",NA,NA,NA,NA,2021-01-31,23.03
"Laufen",151,585,3758000,3551000,9811,"01/31/21 11:04:58","01/31/21 09:03:40","01/31/21 09:03:40",3758000,6.401,"TRUE",8.239171,"Kilometer",8.35552802027598,430.852483680749,2021-01-31,62.63
"Gehen",95,227,2714000,2714000,4104,"01/31/21 15:18:51","01/31/21 13:54:41","01/31/21 13:54:41",2714000,0,"TRUE",NA,NA,NA,NA,2021-01-31,45.23
"Gehen",94,158,1997000,1997000,2691,"01/31/21 19:07:41","01/31/21 18:25:12","01/31/21 18:25:12",1997000,3.048,"TRUE",NA,NA,NA,NA,2021-01-31,33.28
"Gehen",92,263,3430000,3430000,4428,"02/01/21 15:16:17","02/01/21 14:11:21","02/01/21 14:11:21",3430000,9.144,"TRUE",NA,NA,NA,NA,2021-02-01,57.17
"Aerobic",96,80,1331000,1331000,964,"02/01/21 16:16:52","02/01/21 15:49:29","02/01/21 15:49:29",1331000,NA,"TRUE",NA,NA,NA,NA,2021-02-01,22.18
"Gehen",91,153,1997000,1997000,2657,"02/01/21 19:18:29","02/01/21 18:35:02","02/01/21 18:35:02",1997000,0,"TRUE",NA,NA,NA,NA,2021-02-01,33.28
"Gehen",102,112,1331000,1331000,1966,"02/02/21 07:44:08","02/02/21 07:11:06","02/02/21 07:11:06",1331000,0.863,"TRUE",NA,NA,NA,NA,2021-02-02,22.18
"Laufen",148,688,4621000,4416000,12102,"02/02/21 10:04:47","02/02/21 08:11:46","02/02/21 08:11:46",4621000,6.706,"TRUE",10.103632,"Kilometer",8.23720108695652,437.041655532793,2021-02-02,77.02
"Gehen",97,220,2509000,2509000,3979,"02/02/21 15:00:49","02/02/21 14:13:30","02/02/21 14:13:30",2509000,0,"TRUE",NA,NA,NA,NA,2021-02-02,41.82
"Gehen",103,139,1638000,1638000,2357,"01/24/20 17:49:45","01/23/20 18:45:30","01/23/20 18:45:30",1638000,0,"FALSE",NA,NA,NA,NA,2020-01-24,27.3
"Gehen",114,155,1587000,1587000,2582,"01/24/20 17:49:45","01/24/20 07:54:00","01/24/20 07:54:00",1587000,0,"FALSE",NA,NA,NA,NA,2020-01-24,26.45
"Gehen",107,236,2560000,2560000,4038,"01/24/20 17:49:46","01/24/20 14:15:27","01/24/20 14:15:27",2560000,3.048,"FALSE",NA,NA,NA,NA,2020-01-24,42.67
"Gehen",102,134,1587000,1587000,2190,"01/25/20 07:01:15","01/24/20 18:46:48","01/24/20 18:46:48",1587000,0,"FALSE",NA,NA,NA,NA,2020-01-25,26.45
"Gehen",106,229,2509000,2509000,4041,"01/25/20 15:19:55","01/25/20 14:26:59","01/25/20 14:26:59",2509000,0,"FALSE",NA,NA,NA,NA,2020-01-25,41.82
"Gehen",107,119,1382000,1382000,2034,"01/25/20 19:21:41","01/25/20 18:43:50","01/25/20 18:43:50",1382000,0,"FALSE",NA,NA,NA,NA,2020-01-25,23.03
"Gehen",109,99,1177000,1177000,1680,"01/27/20 01:55:19","01/26/20 07:46:21","01/26/20 07:46:21",1177000,0,"FALSE",NA,NA,NA,NA,2020-01-27,19.62
"Gehen",109,225,2407000,2407000,3972,"01/27/20 01:55:20","01/26/20 14:08:38","01/26/20 14:08:38",2407000,0,"FALSE",NA,NA,NA,NA,2020-01-27,40.12
"Gehen",104,121,1382000,1382000,1986,"01/27/20 01:55:20","01/26/20 18:48:32","01/26/20 18:48:32",1382000,3.048,"FALSE",NA,NA,NA,NA,2020-01-27,23.03
"Gehen",102,259,3072000,3072000,4413,"01/27/20 15:34:00","01/27/20 14:34:41","01/27/20 14:34:41",3072000,0,"FALSE",NA,NA,NA,NA,2020-01-27,51.2
"Gehen",102,124,1587000,1587000,1982,"01/27/20 19:20:27","01/27/20 18:46:25","01/27/20 18:46:25",1587000,0,"FALSE",NA,NA,NA,NA,2020-01-27,26.45
"Gehen",102,83,922000,922000,1388,"01/28/20 18:10:37","01/28/20 07:38:42","01/28/20 07:38:42",922000,0,"FALSE",NA,NA,NA,NA,2020-01-28,15.37
"Gehen",107,214,2304000,2304000,3752,"01/28/20 18:10:37","01/28/20 14:14:39","01/28/20 14:14:39",2304000,0,"FALSE",NA,NA,NA,NA,2020-01-28,38.4
"Gehen",106,140,1587000,1587000,2311,"01/28/20 19:26:09","01/28/20 18:41:45","01/28/20 18:41:45",1587000,0,"FALSE",NA,NA,NA,NA,2020-01-28,26.45
"Gehen",114,213,2253000,2253000,3663,"01/29/20 21:24:32","01/29/20 14:56:02","01/29/20 14:56:02",2253000,9.144,"FALSE",NA,NA,NA,NA,2020-01-29,37.55
"Gehen",104,121,1434000,1434000,2079,"01/29/20 21:24:32","01/29/20 18:44:44","01/29/20 18:44:44",1434000,0,"FALSE",NA,NA,NA,NA,2020-01-29,23.9
"Gehen",101,155,2099000,2099000,2389,"01/30/20 09:42:05","01/30/20 07:40:25","01/30/20 07:40:25",2099000,0,"FALSE",NA,NA,NA,NA,2020-01-30,34.98
"Laufen",147,192,1407000,1277000,3403,"01/30/20 10:13:13","01/30/20 09:44:21","01/30/20 09:44:21",1407000,0.914,"FALSE",2.766953,"Kilometer",7.70817227877839,467.036785089933,2020-01-30,23.45
"Training",127,147,1886000,1763000,316,"01/30/20 10:59:55","01/30/20 10:14:47","01/30/20 10:14:47",1886000,2.743,"FALSE",NA,NA,NA,NA,2020-01-30,31.43
"Gehen",106,248,2867000,2867000,4160,"01/30/20 21:37:34","01/30/20 14:16:22","01/30/20 14:16:22",2867000,0,"FALSE",NA,NA,NA,NA,2020-01-30,47.78
"Gehen",107,110,1280000,1280000,1852,"01/30/20 21:37:34","01/30/20 18:47:43","01/30/20 18:47:43",1280000,0,"FALSE",NA,NA,NA,NA,2020-01-30,21.33
"Gehen",109,153,1689000,1689000,2638,"01/31/20 16:19:55","01/31/20 07:53:39","01/31/20 07:53:39",1689000,12.192,"FALSE",NA,NA,NA,NA,2020-01-31,28.15
"Gehen",111,218,2356000,2356000,3809,"01/31/20 16:19:55","01/31/20 14:43:14","01/31/20 14:43:14",2356000,6.096,"FALSE",NA,NA,NA,NA,2020-01-31,39.27
"Gehen",103,128,1536000,1536000,2183,"01/31/20 21:15:02","01/31/20 18:43:02","01/31/20 18:43:02",1536000,0,"FALSE",NA,NA,NA,NA,2020-01-31,25.6
"Gehen",108,266,3277000,3277000,4370,"02/01/20 21:15:31","02/01/20 14:11:14","02/01/20 14:11:14",3277000,0,"FALSE",NA,NA,NA,NA,2020-02-01,54.62
"Gehen",104,131,1587000,1587000,2166,"02/01/20 21:15:31","02/01/20 18:46:52","02/01/20 18:46:52",1587000,0,"FALSE",NA,NA,NA,NA,2020-02-01,26.45
"Gehen",110,234,2508000,2508000,4083,"02/03/20 05:55:48","02/02/20 14:21:55","02/02/20 14:21:55",2508000,0,"FALSE",NA,NA,NA,NA,2020-02-03,41.8
"Gehen",104,137,1690000,1690000,2237,"02/03/20 05:55:48","02/02/20 18:45:35","02/02/20 18:45:35",1690000,3.048,"FALSE",NA,NA,NA,NA,2020-02-03,28.17
"Gehen",107,129,1434000,1434000,2230,"02/03/20 08:24:31","02/03/20 07:42:59","02/03/20 07:42:59",1434000,0,"FALSE",NA,NA,NA,NA,2020-02-03,23.9
"Gehen",105,236,2611000,2611000,4170,"02/03/20 17:20:04","02/03/20 14:12:58","02/03/20 14:12:58",2611000,30.48,"FALSE",NA,NA,NA,NA,2020-02-03,43.52
"Laufen",148,33,272000,263000,673,"02/03/20 17:19:59","02/03/20 15:32:30","02/03/20 15:32:30",272000,0.914,"FALSE",0.544015,"Kilometer",7.42955133079848,484.55146747241,2020-02-03,4.53
"Training",144,392,2974000,2970000,4521,"02/03/20 17:19:59","02/03/20 15:49:11","02/03/20 15:49:11",2974000,22.555,"FALSE",NA,NA,NA,NA,2020-02-03,49.57
"Gehen",109,150,1741000,1741000,2479,"02/03/20 19:21:19","02/03/20 18:39:12","02/03/20 18:39:12",1741000,18.288,"FALSE",NA,NA,NA,NA,2020-02-03,29.02
"Gehen",111,227,2509000,2509000,4059,"02/04/20 20:48:52","02/04/20 14:20:13","02/04/20 14:20:13",2509000,45.72,"FALSE",NA,NA,NA,NA,2020-02-04,41.82
"Gehen",107,115,1383000,1383000,1929,"02/04/20 20:48:53","02/04/20 18:45:36","02/04/20 18:45:36",1383000,15.24,"FALSE",NA,NA,NA,NA,2020-02-04,23.05
"Gehen",110,87,921000,921000,1374,"02/05/20 14:10:07","02/05/20 02:42:00","02/05/20 02:42:00",921000,5.181,"FALSE",NA,NA,NA,NA,2020-02-05,15.35
"Gehen",106,202,2202000,2202000,3659,"02/05/20 15:10:42","02/05/20 14:22:35","02/05/20 14:22:35",2202000,36.576,"FALSE",NA,NA,NA,NA,2020-02-05,36.7
"Gehen",99,135,1690000,1690000,2273,"02/05/20 20:51:27","02/05/20 18:46:16","02/05/20 18:46:16",1690000,0,"FALSE",NA,NA,NA,NA,2020-02-05,28.17
"Gehen",101,225,2406000,2406000,4016,"02/06/20 20:57:43","02/06/20 14:06:50","02/06/20 14:06:50",2406000,12.192,"FALSE",NA,NA,NA,NA,2020-02-06,40.1
"Gehen",100,133,1638000,1638000,2225,"02/06/20 20:57:43","02/06/20 18:43:19","02/06/20 18:43:19",1638000,3.048,"FALSE",NA,NA,NA,NA,2020-02-06,27.3
"Gehen",101,219,2457000,2457000,3872,"02/07/20 17:23:45","02/07/20 14:20:04","02/07/20 14:20:04",2457000,0,"FALSE",NA,NA,NA,NA,2020-02-07,40.95
"Gehen",103,143,1689000,1689000,2440,"02/07/20 19:09:40","02/07/20 18:34:22","02/07/20 18:34:22",1689000,0,"FALSE",NA,NA,NA,NA,2020-02-07,28.15
"Gehen",103,125,1433000,1433000,2148,"02/08/20 13:40:00","02/08/20 07:30:54","02/08/20 07:30:54",1433000,2.387,"FALSE",NA,NA,NA,NA,2020-02-08,23.88
"Gehen",100,229,2509000,2509000,3999,"02/08/20 21:04:53","02/08/20 14:14:31","02/08/20 14:14:31",2509000,0,"FALSE",NA,NA,NA,NA,2020-02-08,41.82
"Gehen",91,136,1741000,1741000,2226,"02/08/20 21:04:53","02/08/20 18:46:44","02/08/20 18:46:44",1741000,0,"FALSE",NA,NA,NA,NA,2020-02-08,29.02
"Gehen",98,143,1639000,1639000,2505,"02/09/20 11:28:16","02/09/20 07:45:50","02/09/20 07:45:50",1639000,0,"FALSE",NA,NA,NA,NA,2020-02-09,27.32
"Training",132,422,3493000,3491000,4658,"02/09/20 11:28:11","02/09/20 08:46:12","02/09/20 08:46:12",3493000,4.572,"FALSE",NA,NA,NA,NA,2020-02-09,58.22
"Gehen",94,279,3686000,3686000,4460,"02/09/20 18:12:06","02/09/20 14:32:53","02/09/20 14:32:53",3686000,0,"FALSE",NA,NA,NA,NA,2020-02-09,61.43
"Gehen",97,132,1638000,1638000,2142,"02/09/20 19:12:56","02/09/20 18:41:13","02/09/20 18:41:13",1638000,3.048,"FALSE",NA,NA,NA,NA,2020-02-09,27.3
"Gehen",112,97,1024000,1024000,1597,"02/10/20 12:43:23","02/10/20 02:44:13","02/10/20 02:44:13",1024000,12.192,"FALSE",NA,NA,NA,NA,2020-02-10,17.07
"Gehen",104,221,2458000,2458000,3859,"02/11/20 05:14:13","02/10/20 14:24:48","02/10/20 14:24:48",2458000,36.576,"FALSE",NA,NA,NA,NA,2020-02-11,40.97
"Gehen",96,130,1588000,1588000,2201,"02/11/20 05:14:13","02/10/20 18:42:30","02/10/20 18:42:30",1588000,0,"FALSE",NA,NA,NA,NA,2020-02-11,26.47
"Gehen",99,120,1331000,1331000,2010,"02/11/20 18:38:37","02/11/20 07:27:57","02/11/20 07:27:57",1331000,0,"FALSE",NA,NA,NA,NA,2020-02-11,22.18
"Gehen",102,210,2355000,2355000,3633,"02/11/20 18:38:38","02/11/20 14:22:41","02/11/20 14:22:41",2355000,9.144,"FALSE",NA,NA,NA,NA,2020-02-11,39.25
"Training",131,272,2487000,2341000,2999,"02/11/20 18:38:35","02/11/20 16:15:18","02/11/20 16:15:18",2487000,13.106,"FALSE",NA,NA,NA,NA,2020-02-11,41.45
"Gehen",103,87,973000,973000,1492,"02/11/20 21:11:01","02/11/20 19:26:28","02/11/20 19:26:28",973000,0,"FALSE",NA,NA,NA,NA,2020-02-11,16.22
"Gehen",100,142,1638000,1638000,2458,"02/12/20 10:04:49","02/12/20 07:39:30","02/12/20 07:39:30",1638000,3.048,"FALSE",NA,NA,NA,NA,2020-02-12,27.3
"Gehen",103,238,2663000,2663000,4083,"02/12/20 15:22:10","02/12/20 14:20:33","02/12/20 14:20:33",2663000,6.096,"FALSE",NA,NA,NA,NA,2020-02-12,44.38
"Gehen",100,130,1587000,1587000,2209,"02/12/20 21:32:24","02/12/20 18:43:23","02/12/20 18:43:23",1587000,0,"FALSE",NA,NA,NA,NA,2020-02-12,26.45
"Gehen",99,243,2867000,2867000,3977,"02/13/20 15:19:11","02/13/20 14:25:16","02/13/20 14:25:16",2867000,6.096,"FALSE",NA,NA,NA,NA,2020-02-13,47.78
"Gehen",96,118,1484000,1484000,1886,"02/13/20 21:03:16","02/13/20 18:45:32","02/13/20 18:45:32",1484000,3.048,"FALSE",NA,NA,NA,NA,2020-02-13,24.73
"Gehen",107,227,2457000,2457000,3927,"02/14/20 14:56:30","02/14/20 14:10:20","02/14/20 14:10:20",2457000,0,"FALSE",NA,NA,NA,NA,2020-02-14,40.95
"Gehen",104,135,1485000,1485000,2352,"02/14/20 21:05:24","02/14/20 18:53:39","02/14/20 18:53:39",1485000,0,"FALSE",NA,NA,NA,NA,2020-02-14,24.75
"Gehen",98,240,2918000,2918000,4136,"02/15/20 15:23:39","02/15/20 14:14:11","02/15/20 14:14:11",2918000,3.048,"FALSE",NA,NA,NA,NA,2020-02-15,48.63
"Gehen",100,142,1587000,1587000,2426,"02/15/20 19:18:20","02/15/20 18:37:52","02/15/20 18:37:52",1587000,0,"FALSE",NA,NA,NA,NA,2020-02-15,26.45
"Gehen",109,164,1792000,1792000,2777,"02/16/20 14:36:01","02/16/20 14:02:40","02/16/20 14:02:40",1792000,3.048,"FALSE",NA,NA,NA,NA,2020-02-16,29.87
"Gehen",102,133,1485000,1485000,2293,"02/16/20 19:23:22","02/16/20 18:41:42","02/16/20 18:41:42",1485000,0,"FALSE",NA,NA,NA,NA,2020-02-16,24.75
"Gehen",99,134,1588000,1588000,2203,"02/17/20 19:26:21","02/17/20 18:44:41","02/17/20 18:44:41",1588000,0,"FALSE",NA,NA,NA,NA,2020-02-17,26.47
"Gehen",105,112,1280000,1280000,1878,"02/18/20 20:41:38","02/18/20 07:25:01","02/18/20 07:25:01",1280000,1.066,"FALSE",NA,NA,NA,NA,2020-02-18,21.33
"Gehen",101,239,2662000,2662000,4245,"02/18/20 20:41:38","02/18/20 14:14:37","02/18/20 14:14:37",2662000,3.048,"FALSE",NA,NA,NA,NA,2020-02-18,44.37
"Gehen",100,132,1587000,1587000,2237,"02/18/20 20:41:39","02/18/20 18:34:02","02/18/20 18:34:02",1587000,0,"FALSE",NA,NA,NA,NA,2020-02-18,26.45
"Gehen",108,232,2560000,2560000,4011,"02/19/20 21:06:03","02/19/20 14:15:54","02/19/20 14:15:54",2560000,12.192,"FALSE",NA,NA,NA,NA,2020-02-19,42.67
"Gehen",104,123,1484000,1484000,2062,"02/19/20 21:06:03","02/19/20 18:42:09","02/19/20 18:42:09",1484000,9.144,"FALSE",NA,NA,NA,NA,2020-02-19,24.73
"Gehen",100,108,1485000,1485000,1771,"02/20/20 14:01:06","02/20/20 08:57:18","02/20/20 08:57:18",1485000,3.048,"FALSE",NA,NA,NA,NA,2020-02-20,24.75
"Gehen",105,226,2458000,2458000,3973,"02/20/20 20:34:51","02/20/20 14:19:01","02/20/20 14:19:01",2458000,6.096,"FALSE",NA,NA,NA,NA,2020-02-20,40.97
"Gehen",98,123,1587000,1587000,2046,"02/20/20 20:34:51","02/20/20 18:45:16","02/20/20 18:45:16",1587000,0,"FALSE",NA,NA,NA,NA,2020-02-20,26.45
"Gehen",106,229,2508000,2508000,4055,"02/21/20 15:11:19","02/21/20 14:14:20","02/21/20 14:14:20",2508000,3.048,"FALSE",NA,NA,NA,NA,2020-02-21,41.8
"Gehen",101,147,1792000,1792000,2460,"02/21/20 21:21:52","02/21/20 18:43:08","02/21/20 18:43:08",1792000,0,"FALSE",NA,NA,NA,NA,2020-02-21,29.87
"Gehen",103,99,1076000,1076000,1738,"02/22/20 08:11:19","02/22/20 07:39:39","02/22/20 07:39:39",1076000,0,"FALSE",NA,NA,NA,NA,2020-02-22,17.93
"Gehen",108,209,2304000,2304000,3555,"02/22/20 14:37:06","02/22/20 13:54:17","02/22/20 13:54:17",2304000,3.048,"FALSE",NA,NA,NA,NA,2020-02-22,38.4
"Gehen",108,126,1382000,1382000,2148,"02/23/20 20:35:10","02/23/20 07:35:50","02/23/20 07:35:50",1382000,15.24,"FALSE",NA,NA,NA,NA,2020-02-23,23.03
"Gehen",104,228,2560000,2560000,3963,"02/23/20 20:35:10","02/23/20 15:08:57","02/23/20 15:08:57",2560000,30.48,"FALSE",NA,NA,NA,NA,2020-02-23,42.67
